ticker,exchange,security_name,is_etf
INLX,NYSE American,"Intellinetics, Inc. Common Stock",N
INM,NASDAQ,InMed Pharmaceuticals Inc. - Common Shares,N
INMB,NASDAQ,INmune Bio Inc. - Common stock,N
INMD,NASDAQ,InMode Ltd.  - Ordinary Shares,N
INMU,NYSE Arca,iShares Intermediate Muni Income Active ETF,Y
INN,NYSE,"Summit Hotel Properties, Inc. Common Stock",N
INN$E,NYSE,"Summit Hotel Properties, Inc. 6.250% Series E Cumulative Redeemable Preferred Stock",N
INN$F,NYSE,"Summit Hotel Properties, Inc. 5.875% Series F Cumulative Redeemable Preferred Stock, $0.01 par value per share",N
INNV,NASDAQ,InnovAge Holding Corp. - Common Stock,N
INO,NASDAQ,"Inovio Pharmaceuticals, Inc. - Common Stock",N
INOD,NASDAQ,Innodata Inc. - Common Stock,N
INOV,NYSE Arca,Innovator International Developed Power Buffer ETF  November,Y
INQQ,NYSE Arca,INQQ The India Internet ETF,Y
INR,NYSE,"Infinity Natural Resources, Inc. Class A Common Stock",N
INRO,NASDAQ,iShares U.S. Industry Rotation Active ETF,Y
INSE,NASDAQ,"Inspired Entertainment, Inc. - Common Stock",N
INSG,NASDAQ,Inseego Corp. - Common Stock,N
INSM,NASDAQ,Insmed Incorporated - Common Stock,N
INSP,NYSE,"Inspire Medical Systems, Inc. Common Stock",N
INSW,NYSE,"International Seaways, Inc. Common Stock",N
INTA,NASDAQ,"Intapp, Inc. - Common Stock",N
INTC,NASDAQ,Intel Corporation - Common Stock,N
INTF,NYSE Arca,iShares International Equity Factor ETF,Y
INTG,NASDAQ,The Intergroup Corporation - Common Stock,N
INTJ,NASDAQ,Intelligent Group Limited - Class A Ordinary Shares,N
INTR,NASDAQ,Inter & Co. Inc. - Class A Common Shares,N
INTS,NASDAQ,"Intensity Therapeutics, Inc. - Common Stock",N
INTT,NYSE American,inTest Corporation Common Stock,N
INTU,NASDAQ,Intuit Inc. - Common Stock,N
INTW,NASDAQ,GraniteShares 2x Long INTC Daily ETF,Y
INTZ,NASDAQ,Intrusion Inc. - Common Stock,N
INUV,NYSE American,"Inuvo, Inc.",N
INV,NASDAQ,"Innventure, Inc. - Common Stock",N
INVA,NASDAQ,"Innoviva, Inc. - Common Stock",N
INVE,NASDAQ,"Identiv, Inc. - Common Stock",N
INVG,NYSE Arca,GMO Systematic Investment Grade Credit ETF,Y
INVH,NYSE,Invitation Homes Inc. Common Stock,N
INVN,NYSE Arca,Alger Russell Innovation ETF,Y
INVX,NYSE,"Innovex International, Inc. Common Stock",N
INVZ,NASDAQ,Innoviz Technologies Ltd. - Ordinary shares,N
IOCT,NYSE Arca,Innovator International Developed Power Buffer ETF - October,Y
ION,NYSE Arca,ProShares S&P Global Core Battery Metals ETF,Y
IONL,NASDAQ,GraniteShares 2x Long IONQ Daily ETF,Y
IONQ,NYSE,"IonQ, Inc. Common Stock",N
IONQ.W,NYSE,"IonQ, Inc. Redeemable warrants, each whole warrant exercisable for one share of Common Stock, each at an exercise price of $11.50 per share",N
IONR,NASDAQ,ioneer Ltd - American Depositary Shares,N
IONS,NASDAQ,"Ionis Pharmaceuticals, Inc. - Common Stock",N
IONX,NASDAQ,Defiance Daily Target 2X Long IONQ ETF,Y
IONZ,NASDAQ,Defiance Daily Target 2x Short IONQ ETF,Y
IOO,NYSE Arca,iShares Global 100 ETF,Y
IOPP,NYSE Arca,Simplify Tara India Opportunities ETF,Y
IOR,NYSE American,"Income Opportunity Realty Investors, Inc. Common Stock",N
IOSP,NASDAQ,Innospec Inc. - Common Stock,N
IOT,NYSE,Samsara Inc. Class A Common Stock,N
IOTR,NASDAQ,iOThree Limited - Ordinary Shares,N
IOVA,NASDAQ,"Iovance Biotherapeutics, Inc. - Common Stock",N
IOYY,NASDAQ,GraniteShares YieldBOOST IONQ ETF,Y
IP,NYSE,International Paper Company Common Stock,N
IPAC,NYSE Arca,iShares Core MSCI Pacific ETF,Y
IPAR,NASDAQ,"Interparfums, Inc. - Common Stock",N
IPAY,NYSE Arca,Amplify Digital Payments ETF,Y
IPB,NYSE,"Merrill Lynch & Co., Inc. 6.0518% Index Plus Trust Certificates Series 2003-1",Y
IPCX,NASDAQ,Inflection Point Acquisition Corp. III - Class A ordinary shares,N
IPCXR,NASDAQ,Inflection Point Acquisition Corp. III - Rights,N
IPCXU,NASDAQ,Inflection Point Acquisition Corp. III - Units,N
IPDN,NASDAQ,"Professional Diversity Network, Inc. - Common Stock",N
IPEX,NASDAQ,Inflection Point Acquisition Corp. - Class A Ordinary Shares,N
IPEXR,NASDAQ,Inflection Point Acquisition Corp. - Right,N
IPEXU,NASDAQ,Inflection Point Acquisition Corp. - Unit,N
IPFXU,NASDAQ,Inflection Point Acquisition Corp. VI - Units,N
IPGP,NASDAQ,IPG Photonics Corporation - Common Stock,N
IPHA,NASDAQ,Innate Pharma S.A. - American Depositary Shares,N
IPI,NYSE,"Intrepid Potash, Inc Common Stock",N
IPKW,NASDAQ,Invesco International BuyBack Achievers ETF,Y
IPM,NASDAQ,Intelligent Protection Management Corp.  - Common Stock,N
IPO,NYSE Arca,Renaissance IPO ETF,Y
IPOD,NASDAQ,Dune Acquisition Corporation II - Class A ordinary shares,N
IPODU,NASDAQ,Dune Acquisition Corporation II - Units,N
IPODW,NASDAQ,Dune Acquisition Corporation II - Warrants,N
IPOS,NYSE Arca,Renaissance Capital Greenwich Fund,Y
IPSC,NASDAQ,"Century Therapeutics, Inc. - Common Stock",N
IPST,NASDAQ,"IP Strategy Holdings, Inc. - Common Stock",N
IPW,NASDAQ,iPower Inc. - Common Stock,N
IPWR,NASDAQ,Ideal Power Inc. - Common Stock,N
IPX,NASDAQ,IperionX Limited - American Depositary Share,N
IQ,NASDAQ,"iQIYI, Inc. - American Depositary Shares",N
IQDF,NYSE Arca,FlexShares International Quality Dividend Index Fund,Y
IQDY,NYSE Arca,FlexShares International Quality Dividend Dynamic Index Fund,Y
IQHI,NYSE Arca,NYLI MacKay High Income ETF,Y
IQI,NYSE,Invesco Quality Municipal Income Trust Common Stock,N
IQLT,NYSE Arca,iShares MSCI Intl Quality Factor ETF,Y
IQMM,NYSE Arca,ProShares GENIUS Money Market ETF,Y
IQQQ,NASDAQ,ProShares Nasdaq-100 High Income ETF,Y
IQRA,NYSE Arca,NYLI CBRE Real Assets ETF,Y
IQSI,NYSE Arca,NYLI Candriam International Equity ETF,Y
IQSM,NYSE Arca,NYLI Candriam U.S. Mid Cap Equity ETF,Y
IQST,NASDAQ,iQSTEL Inc. - Common Stock,N
IQSU,NYSE Arca,NYLI Candriam U.S. Large Cap Equity ETF,Y
IQSZ,NYSE Arca,Invesco Global Equity Net Zero ETF,Y
IQV,NYSE,"IQVIA Holdings, Inc. Common Stock",N
IR,NYSE,Ingersoll Rand Inc. Common Stock,N
IRAB,NYSE,Iris Acquisition Corp II Class A Ordinary Shares,N
IRAB.U,NYSE,"Iris Acquisition Corp II Units, each consisting of one Class A Ordinary Share and one-half of one redeemable Warrant",N
IRAB.W,NYSE,"Iris Acquisition Corp II Redeemable Warrants, each whole warrant exercisable for one Class A Ordinary Share at an exercise price of $11.50 per share",N
IRD,NASDAQ,"Opus Genetics, Inc. - Common Stock",N
IRDM,NASDAQ,Iridium Communications Inc - Common Stock,N
IRE,NYSE Arca,Defiance Daily Target 2X Long IREN ETF,Y
IREG,NASDAQ,Leverage Shares 2X Long IREN Daily ETF,Y
IREN,NASDAQ,IREN Limited - Ordinary Shares,N
IRET,NYSE Arca,iREIT - MarketVector Quality REIT Index ETF,Y
IRHO,NASDAQ,Iron Horse Acquisitions II Corp. - Common Stock,N
IRHOR,NASDAQ,Iron Horse Acquisitions II Corp. - Rights,N
IRHOU,NASDAQ,Iron Horse Acquisitions II Corp. - Units,N
IRIX,NASDAQ,IRIDEX Corporation - Common Stock,N
IRM,NYSE,Iron Mountain Incorporated (Delaware)Common Stock REIT,N
IRMD,NASDAQ,iRadimed Corporation - Common Stock,N
IRON,NASDAQ,"Disc Medicine, Inc. - Common Stock",N
IRS,NYSE,IRSA Inversiones Y Representaciones S.A. Global Depositary Shares (Each representing ten shares of Common Stock),N
IRS.W,NYSE,IRSA Inversiones Y Representaciones S.A. Warrants to purchase Common Shares,N
IRT,NYSE,"Independence Realty Trust, Inc. Common Stock",N
IRTC,NASDAQ,"iRhythm Holdings, Inc.  - Common Stock",N
IRTR,NYSE Arca,iShares LifePath Retirement ETF,Y
IRVH,NYSE Arca,Global X Interest Rate Volatility & Inflation Hedge ETF,Y
IRWD,NASDAQ,"Ironwood Pharmaceuticals, Inc. - Class A Common Stock",N
ISBA,NASDAQ,Isabella Bank Corporation - Common stock,N
ISCB,NYSE Arca,iShares Morningstar Small-Cap ETF,Y
ISCF,NYSE Arca,iShares International Small-Cap Equity Factor ETF,Y
ISCG,NYSE Arca,iShares Morningstar Small-Cap Growth ETF,Y
ISCV,NYSE Arca,iShares Morningstar Small-Cap Value ETF,Y
ISD,NYSE,"PGIM High Yield Bond Fund, Inc.",N
ISEP,NYSE Arca,Innovator International Developed Power Buffer ETF  September,Y
ISHG,NASDAQ,iShares 1-3 Year International Treasury Bond ETF,Y
ISHP,NASDAQ,First Trust S-Network E-Commerce ETF,Y
ISMD,NYSE Arca,Inspire Small/Mid Cap ETF,Y
ISOU,NYSE American,IsoEnergy Ltd. Common Shares,N
ISPC,NASDAQ,iSpecimen Inc. - Common Stock,N
ISPR,NASDAQ,Ispire Technology Inc. - Common Stock,N
ISRA,NYSE Arca,VanEck Israel ETF,Y
ISRG,NASDAQ,"Intuitive Surgical, Inc. - Common Stock",N
ISSC,NASDAQ,"Innovative Solutions and Support, Inc. - Common Stock",N
ISTB,NASDAQ,iShares Core 1-5 Year USD Bond ETF,Y
ISTR,NASDAQ,Investar Holding Corporation - Common Stock,N
ISUL,NASDAQ,GraniteShares 2x Long ISRG Daily ETF,Y
ISWN,NYSE Arca,Amplify BlackSwan ISWN ETF,Y
IT,NYSE,"Gartner, Inc. Common Stock",N
ITAN,NYSE Arca,Sparkline Intangible Value ETF,Y
ITDB,NYSE Arca,iShares LifePath Target Date 2030 ETF,Y
ITDC,NYSE Arca,iShares LifePath Target Date 2035 ETF,Y
ITDD,NYSE Arca,iShares LifePath Target Date 2040 ETF,Y
ITDE,NYSE Arca,iShares LifePath Target Date 2045 ETF,Y
ITDF,NYSE Arca,iShares LifePath Target Date 2050 ETF,Y
ITDG,NYSE Arca,iShares LifePath Target Date 2055 ETF,Y
ITDH,NYSE Arca,iShares LifePath Target Date 2060 ETF,Y
ITDI,NYSE Arca,iShares LifePath Target Date 2065 ETF,Y
ITDJ,NYSE Arca,iShares LifePath Target Date 2070 ETF,Y
ITEQ,NYSE Arca,Amplify BlueStar Israel Technology ETF,Y
ITGR,NYSE,Integer Holdings Corporation Common Stock,N
ITHA,NASDAQ,ITHAX Acquisition Corp III - Class A Ordinary Shares,N
ITHAU,NASDAQ,ITHAX Acquisition Corp III - Units,N
ITHAW,NASDAQ,ITHAX Acquisition Corp III - Warrants,N
ITIC,NASDAQ,Investors Title Company - Common Stock,N
ITOC,NASDAQ,iTonic Holdings Ltd - Class A Ordinary Shares,N
ITOT,NYSE Arca,iShares Core S&P Total U.S. Stock Market ETF,Y
ITP,NYSE American,"IT Tech Packaging, Inc. Common Stock",N
ITRG,NYSE American,Integra Resources Corp. Common Shares,N
ITRI,NASDAQ,"Itron, Inc. - Common Stock",N
ITRN,NASDAQ,Ituran Location and Control Ltd. - Ordinary Shares,N
ITT,NYSE,ITT Inc. Common Stock,N
ITUB,NYSE,Itau Unibanco Banco Holding SA American Depositary Shares (Each repstg 500 Preferred shares),N
ITW,NYSE,Illinois Tool Works Inc. Common Stock,N
IUS,NASDAQ,Invesco RAFI Strategic US ETF,Y
IUSB,NASDAQ,iShares Core Universal USD Bond ETF,Y
IUSG,NASDAQ,iShares Core S&P U.S. Growth ETF,Y
IUSV,NASDAQ,iShares Core S&P U.S. Value ETF,Y
IVA,NASDAQ,Inventiva S.A. - American Depository Shares,N
IVAL,NASDAQ,Alpha Architect International Quantitative Value ETF,Y
IVDA,NASDAQ,"Iveda Solutions, Inc. - Common Stock",N
IVDAW,NASDAQ,"Iveda Solutions, Inc. - Warrant",N
IVE,NYSE Arca,iShares S&P 500 Value ETF,Y
IVEP,NYSE Arca,Dan IVES Wedbush AI Power & Infrastructure ETF,Y
IVES,NYSE Arca,Dan IVES Wedbush AI Revolution ETF,Y
IVF,NASDAQ,"INVO Fertility, Inc. - Common Stock",N
IVLU,NYSE Arca,iShares MSCI Intl Value Factor ETF,Y
IVOG,NYSE Arca,Vanguard S&P Mid-Cap 400 Growth ETF,Y
IVOL,NYSE Arca,Quadratic Interest Rate Volatility and Inflation Hedge ETF,Y
IVOO,NYSE Arca,Vanguard S&P Mid-Cap 400 ETF,Y
IVOV,NYSE Arca,Vanguard S&P Mid-Cap 400 Value ETF,Y
IVR,NYSE,INVESCO MORTGAGE CAPITAL INC Common Stock,N
IVR$C,NYSE,"INVESCO MORTGAGE CAPITAL INC 7.5% Fixed-to-Floating Series C Cumulative Redeemable Preferred Stock, Liquation Preference $25.00 per Share",N
IVRS,NYSE Arca,iShares Future Metaverse Tech and Communications ETF,Y
IVSI,NASDAQ,Applied Finance IVS International Large ETF,Y
IVSS,NASDAQ,Applied Finance IVS US SMID ETF,Y
IVSX,NASDAQ,Applied Finance IVS International SMID ETF,Y
IVT,NYSE,InvenTrust Properties Corp. Common Stock,N
IVV,NYSE Arca,iShares Core S&P 500 ETF,Y
IVVD,NASDAQ,"Invivyd, Inc. - Common Stock",N
IVW,NYSE Arca,iShares S&P 500 Growth ETF,Y
IVZ,NYSE,Invesco Ltd Common Stock,N
IWB,NYSE Arca,iShares Russell 1000 ETF,Y
IWC,NYSE Arca,iShares Microcap ETF,Y
IWD,NYSE Arca,iShares Russell 1000 Value ETF,Y
IWDL,NYSE Arca,ETRACS 2x Leveraged US Value Factor TR ETN,Y
IWF,NYSE Arca,iShares Russell 1000 Growth Fund,Y
IWFG,NYSE Arca,NYLI Winslow Focused Large Cap Growth ETF,Y
IWFL,NYSE Arca,ETRACS 2x Leveraged US Growth Factor TR ETN,Y
IWL,NYSE Arca,iShares Russell Top 200 ETF,Y
IWLG,NYSE Arca,NYLI Winslow Large Cap Growth ETF,Y
IWM,NYSE Arca,iShares Russell 2000 Index Fund,Y
IWML,NYSE Arca,ETRACS 2x Leveraged US Size Factor TR ETN,Y
IWMY,NYSE Arca,Defiance R2000 Weekly Distribution ETF,Y
IWN,NYSE Arca,iShares Russell 2000 Value ETF,Y
IWO,NYSE Arca,iShares Russell 2000 Growth Fund,Y
IWP,NYSE Arca,iShares Russell Midcap Growth ETF,Y
IWR,NYSE Arca,iShares Russell Mid-Cap ETF,Y
IWS,NYSE Arca,iShares Russell Mid-Cap Value ETF,Y
IWV,NYSE Arca,iShares Russell 3000 Fund,Y
IWX,NYSE Arca,iShares Russell Top 200 Value ETF,Y
IWY,NYSE Arca,iShares Russell Top 200 Growth ETF,Y
IX,NYSE,ORIX Corporation American Depositary Shares,N
IXC,NYSE Arca,iShares Global Energy ETF,Y
IXG,NYSE Arca,iShares Global Financial ETF,Y
IXHL,NASDAQ,Incannex Healthcare Inc. - Common Stock,N
IXJ,NYSE Arca,iShares Global Healthcare ETF,Y
IXN,NYSE Arca,iShares Global Tech ETF,Y
IXP,NYSE Arca,iShares Global Comm Services ETF,Y
IXUS,NASDAQ,iShares Core MSCI Total International Stock ETF,Y
IYC,NYSE Arca,iShares U.S. Consumer Discretionary ETF,Y
IYE,NYSE Arca,iShares U.S. Energy ETF,Y
IYF,NYSE Arca,iShares U.S. Financial ETF,Y
IYG,NYSE Arca,iShares U.S. Financial Services ETF,Y
IYH,NYSE Arca,iShares U.S. Healthcare ETF,Y
IYK,NYSE Arca,iShares U.S. Consumer Staples ETF,Y
IYM,NYSE Arca,iShares U.S. Basic Materials ETF,Y
IYR,NYSE Arca,iShares U.S. Real Estate ETF,Y
IYW,NYSE Arca,iShares U.S. Technology ETF,Y
IYY,NYSE Arca,iShares Dow Jones U.S. ETF,Y
IZEA,NASDAQ,"IZEA Worldwide, Inc. - Common Stock",N
IZM,NASDAQ,ICZOOM Group Inc. - Class A Ordinary Shares,N
J,NYSE,Jacobs Solutions Inc. Common Stock,N
JA,NYSE Arca,Janus Henderson AA-A CLO ETF,Y
JAAA,NYSE Arca,Janus Henderson AAA CLO ETF,Y
JABS,NYSE Arca,Janus Henderson Asset-Backed Securities ETF,Y
JACK,NASDAQ,Jack In The Box Inc. - Common Stock,N
JACS,NYSE,Jackson Acquisition Company II Class A Ordinary Shares,N
JACS.R,NYSE,"Jackson Acquisition Company II Rights, each right to acquire one-tenth (1/10) of one Class A ordinary share",N
JACS.U,NYSE,"Jackson Acquisition Company II Units, each consisting of one Class A ordinary share and one right to acquire one-tenth (1/10) of one Class A ordinary share",N
JADE,NYSE Arca,JPMorgan Active Developing Markets Equity ETF,Y
JAGU,NYSE American,Jaguar Uranium Corp. Class A Common Shares,N
JAGX,NASDAQ,"Jaguar Health, Inc. - Common Stock",N
JAKK,NASDAQ,"JAKKS Pacific, Inc. - Common Stock",N
JAN,NYSE,"Janus Living, Inc. Class A-1 Common Stock",N
JANX,NASDAQ,"Janux Therapeutics, Inc. - Common Stock",N
JAPN,NASDAQ,Horizon Kinetics Japan Owner Operator ETF,Y
JATT,NASDAQ,JATT II Acquisition Corp - Ordinary Shares,N
JAVA,NYSE Arca,JPMorgan Active Value ETF,Y
JAZZ,NASDAQ,Jazz Pharmaceuticals plc - Ordinary Shares,N
JBDI,NASDAQ,JBDI Holdings Limited - Ordinary Shares,N
JBGS,NYSE,JBG SMITH Properties Common Shares,N
JBHT,NASDAQ,"J.B. Hunt Transport Services, Inc. - Common Stock",N
JBI,NYSE,"Janus International Group, Inc. Common Stock",N
JBIO,NASDAQ,"Jade Biosciences, Inc. - Common Stock",N
JBK,NYSE,Lehman ABS 3.50 3.50% Adjustable Corp Backed Tr Certs GS Cap I,N
JBL,NYSE,Jabil Inc. Common Stock,N
JBLU,NASDAQ,JetBlue Airways Corporation - Common Stock,N
JBND,NYSE,JPMorgan Active Bond ETF,Y
JBS,NYSE,JBS N.V. Class A Common Shares,N
JBSS,NASDAQ,"John B. Sanfilippo & Son, Inc. - Common Stock",N
JBTM,NYSE,JBT Marel Corporation Common Stock,N
JCAP,NASDAQ,"Jefferson Capital, Inc. - Common Stock",N
JCE,NYSE,Nuveen Core Equity Alpha Fund Common Shares of Beneficial Interest,N
JCHI,NYSE Arca,JPMorgan Active China ETF,Y
JCI,NYSE,Johnson Controls International plc Ordinary Share,N
JCPB,NYSE Arca,JPMorgan Core Plus Bond ETF,Y
JCPI,NYSE Arca,JPMorgan Inflation Managed Bond ETF,Y
JCSE,NASDAQ,JE Cleantech Holdings Limited - Ordinary Shares,N
JCTC,NASDAQ,Jewett-Cameron Trading Company - Common Shares,N
JD,NASDAQ,"JD.com, Inc. - American Depositary Shares",N
JDIV,NYSE Arca,JPMorgan Dividend Leaders ETF,Y
JDOC,NASDAQ,JPMorgan Healthcare Leaders ETF,Y
JDST,NYSE Arca,Direxion Daily Junior Gold Miners Index Bear 2X ETF,Y
JDVI,NYSE Arca,John Hancock Disciplined Value International Select ETF,Y
JDVL,NYSE Arca,John Hancock Disciplined Value Select ETF,Y
JDZG,NASDAQ,JIADE LIMITED - Class A Ordinary Shares,N
JEDI,NYSE Arca,Defiance Drone and Modern Warfare ETF,Y
JEF,NYSE,Jefferies Financial Group Inc. Common Stock,N
JELD,NYSE,"JELD-WEN Holding, Inc. Common Stock",N
JEM,NASDAQ,707 Cayman Holdings Limited - Ordinary Shares,N
JEMA,NASDAQ,JPMorgan ActiveBuilders Emerging Markets Equity ETF,Y
JEMB,NYSE Arca,Janus Henderson Emerging Markets Debt Hard Currency ETF,Y
JENA,NYSE,Jena Acquisition Corporation II Class A Ordinary Shares,N
JENA.R,NYSE,"Jena Acquisition Corporation II Rights, each right to acquire one-twentieth (1/20) of one Class A ordinary share",N
JENA.U,NYSE,"Jena Acquisition Corporation II Units, each consisting of one Class A ordinary share and one right",N
JEPI,NYSE Arca,JPMorgan Equity Premium Income ETF,Y
JEPQ,NASDAQ,JPMorgan Nasdaq Equity Premium Income ETF,Y
JETD,NYSE Arca,MAX Airlines -3X Inverse Leveraged ETNs,Y
JETS,NYSE Arca,U.S. Global Jets ETF,Y
JETU,NYSE Arca,MAX Airlines 3X Leveraged ETNs,Y
JF,NASDAQ,J and Friends Holdings Limited - American Depositary Shares,N
JFB,NASDAQ,JFB Construction Holdings - Class A Common Stock,N
JFIN,NASDAQ,Jiayin Group Inc. - American Depositary Shares,N
JFLI,NYSE Arca,JPMorgan Flexible Income ETF,Y
JFLX,NYSE Arca,JPMorgan Flexible Debt ETF,Y
JFR,NYSE,Nuveen Floating Rate Income Fund Common Stock,N
JFU,NASDAQ,9F Inc. - American Depositary Shares,N
JG,NASDAQ,Aurora Mobile Limited - American Depositary Shares,N
JGH,NYSE,Nuveen Global High Income Fund Common Shares of Beneficial Interest,N
JGLO,NASDAQ,JPMorgan Global Select Equity ETF,Y
JGRO,NYSE Arca,JPMorgan Active Growth ETF,Y
JGRW,NYSE Arca,Jensen Quality Growth ETF,Y
JHAC,NYSE Arca,John Hancock Fundamental All Cap Core ETF,Y
JHAI,NASDAQ,Janus Henderson Global Artificial Intelligence ETF,Y
JHCB,NYSE Arca,John Hancock Corporate Bond ETF,Y
JHCP,NYSE Arca,John Hancock Core Plus Bond ETF,Y
JHCR,NYSE Arca,John Hancock Core Bond ETF,Y
JHDG,NYSE Arca,John Hancock Hedged Equity ETF,Y
JHDV,NYSE Arca,John Hancock U.S. High Dividend ETF,Y
JHEM,NYSE Arca,John Hancock Multifactor Emerging Markets ETF,Y
JHG,NYSE,Janus Henderson Group plc Ordinary Shares,N
JHHY,NYSE Arca,John Hancock High Yield ETF,Y
JHI,NYSE,John Hancock Investors Trust Common Stock,N
JHID,NYSE Arca,John Hancock International High Dividend ETF,Y
JHLN,NYSE Arca,John Hancock Global Senior Loan ETF,Y
JHMB,NYSE Arca,John Hancock Mortgage-Backed Securities ETF,Y
JHMD,NYSE Arca,John Hancock Multifactor Developed International ETF,Y
JHML,NYSE Arca,John Hancock Multifactor Large Cap ETF,Y
JHMM,NYSE Arca,John Hancock Multifactor Mid Cap ETF,Y
JHMU,NYSE Arca,John Hancock Dynamic Municipal Bond ETF,Y
JHPI,NYSE Arca,John Hancock Preferred Income ETF,Y
JHS,NYSE,John Hancock Income Securities Trust Common Stock,N
JHSC,NYSE Arca,John Hancock Multifactor Small Cap ETF,Y
JHX,NYSE,James Hardie Industries plc. Ordinary Shares,N
JIDE,NYSE Arca,JPMorgan International Dynamic ETF,Y
JIG,NYSE Arca,JPMorgan International Growth ETF,Y
JIII,NYSE Arca,Janus Henderson Income ETF,Y
JILL,NYSE,"J. Jill, Inc. Common Stock",N
JIRE,NYSE Arca,JPMorgan International Research Enhanced Equity ETF,Y
JIVE,NASDAQ,JPMorgan International Value ETF,Y
JJSF,NASDAQ,J & J Snack Foods Corp. - Common Stock,N
JKHY,NASDAQ,"Jack Henry & Associates, Inc. - Common Stock",N
JKS,NYSE,JinkoSolar Holding Company Limited American Depositary Shares (each representing 4 Common Shares),N
JL,NASDAQ,J-Long Group Limited - Class A Ordinary Shares,N
JLHL,NASDAQ,Julong Holding Limited - Class A Ordinary Shares,N
JLL,NYSE,Jones Lang LaSalle Incorporated Common Stock,N
JLQD,NYSE Arca,Janus Henderson Corporate Bond ETF,Y
JLS,NYSE,Nuveen Mortgage and Income Fund,N
JMBS,NYSE Arca,Janus Henderson Mortgage-Backed Securities ETF,Y
JMEE,NYSE Arca,JPMorgan Small & Mid Cap Enhanced Equity ETF,Y
JMG,NYSE American,JM Group Limited Ordinary Shares,N
JMHI,NYSE Arca,JPMorgan High Yield Municipal ETF,Y
JMIA,NYSE,"Jumia Technologies AG American Depositary Shares, each representing two Ordinary Shares",N
JMID,NASDAQ,Janus Henderson Mid Cap Growth Alpha ETF,Y
JMM,NYSE,Nuveen Multi-Market Income Fund (MA),N
JMMF,NYSE Arca,JPMorgan 100% U.S. Treasury Securities Money Market ETF,Y
JMOM,NYSE Arca,JPMorgan U.S. Momentum Factor ETF,Y
JMSB,NASDAQ,"John Marshall Bancorp, Inc. - Common Stock",N
JMSI,NYSE Arca,JPMorgan Sustainable Municipal Income ETF,Y
JMST,NYSE Arca,JPMorgan Ultra-Short Municipal Income ETF,Y
JMTG,NYSE Arca,JPMorgan Mortgage-Backed Securities ETF,Y
JMUB,NYSE Arca,JPMorgan Municipal ETF,Y
JNJ,NYSE,Johnson & Johnson Common Stock,N
JNK,NYSE Arca,State Street SPDR Bloomberg High Yield Bond ETF,Y
JNUG,NYSE Arca,Direxion Daily Junior Gold Miners Index Bull 2X ETF,Y
JOB,NYSE American,GEE Group Inc. Common Stock,N
JOBY,NYSE,"Joby Aviation, Inc. Common Stock",N
JOBY.W,NYSE,"Joby Aviation, Inc. Warrants",N
JOE,NYSE,St. Joe Company (The) Common Stock,N
JOET,NYSE Arca,Virtus Terranova U.S. Quality Momentum ETF,Y
JOF,NYSE,Japan Smaller Capitalization Fund Inc Common Stock,N
JOJO,NYSE Arca,ATAC Credit Rotation ETF,Y
JOUT,NASDAQ,Johnson Outdoors Inc. - Class A Common Stock,N
JOYT,NASDAQ,JPMorgan Equity and Options Total Return ETF,Y
JOYY,NASDAQ,JOYY Inc. - American Depositary Shares,N
JPAN,NYSE Arca,Matthews Japan Active ETF,Y
JPC,NYSE,Nuveen Preferred & Income Opportunities Fund,N
JPEF,NASDAQ,JPMorgan Equity Focus ETF,Y
JPEM,NYSE Arca,JPMorgan Diversified Return Emerging Markets Equity ETF,Y
JPHY,NYSE Arca,JPMorgan Active High Yield ETF,Y
JPIB,NYSE Arca,JPMorgan International Bond Opportunities ETF,Y
JPIE,NYSE Arca,JPMorgan Income ETF,Y
JPIN,NYSE Arca,JPMorgan Diversified Return International Equity ETF,Y
JPLD,NYSE Arca,JPMorgan Limited Duration Bond ETF,Y
JPM,NYSE,JP Morgan Chase & Co. Common Stock,N
JPM$C,NYSE,"J P Morgan Chase & Co Depositary Shares, each representing a 1/400th interest in a share of 6.00% Non-Cumulative  Preferred Stock, Series EE",N
JPM$D,NYSE,"J P Morgan Chase & Co Depositary Shares, each representing a 1/400th  interest in a share of 5.75% Non-Cumulative  Preferred Stock, Series DD",N
JPM$J,NYSE,"J P Morgan Chase & Co Depositary Shares, each representing a 1/400th interest in a share of JPMorgan Chase & Co. 4.75% Non-Cumulative Preferred Stock, Series GG",N
JPM$K,NYSE,"J P Morgan Chase & Co Depositary Shares, each representing a 1/400th interest in a share of 4.55% Non-Cumulative Preferred Stock, Series JJ",N
JPM$L,NYSE,"J P Morgan Chase & Co Depositary Shares, each representing a 1/400th interest in a share of 4.625% Non-Cumulative Preferred Stock, Series LL",N
JPM$M,NYSE,"J P Morgan Chase & Co Depositary Shares, each representing a 1/400th interest in a share of 4.20% Non-Cumulative Preferred Stock, Series MM",N
JPMB,NYSE Arca,JPMorgan USD Emerging Markets Sovereign Bond ETF,Y
JPME,NYSE Arca,JPMorgan Diversified Return U.S. Mid Cap Equity ETF,Y
JPO,NYSE Arca,YieldMax JP Option Income Strategy ETF,Y
JPRE,NYSE Arca,JPMorgan Realty Income ETF,Y
JPSE,NYSE Arca,JPMorgan Diversified Return U.S. Small Cap Equity ETF,Y
JPST,NYSE Arca,JPMorgan Ultra-Short Income ETF,Y
JPSV,NYSE Arca,JPMorgan Active Small Cap Value ETF,Y
JPUS,NYSE Arca,JPMorgan Diversified Return U.S. Equity ETF,Y
JPXN,NYSE Arca,iShares JPX-Nikkei 400 ETF,Y
JPY,NASDAQ,Lazard Japanese Equity ETF,Y
JQC,NYSE,Nuveen Credit Strategies Income Fund Shares of Beneficial Interest,N
JQUA,NYSE Arca,JPMorgan U.S. Quality Factor ETF,Y
JRE,NYSE Arca,Janus Henderson U.S. Real Estate ETF,Y
JRI,NYSE,Nuveen Real Asset Income and Growth Fund Common Shares of Beneficial Interest,N
JRS,NYSE,Nuveen Real Estate Income Fund Common Shares of Beneficial Interest,N
JRSH,NASDAQ,"Jerash Holdings (US), Inc. - Common Stock",N
JRVR,NASDAQ,"James River Group Holdings, Inc. - Common Stock",N
JSCP,NYSE Arca,JPMorgan Short Duration Core Plus ETF,Y
JSI,NYSE Arca,Janus Henderson Securitized Income ETF,Y
JSM,NASDAQ,"Navient Corporation - 6% Senior Notes due December 15, 2043",N
JSMD,NASDAQ,Janus Henderson Small/Mid Cap Growth Alpha ETF,Y
JSML,NASDAQ,Janus Henderson Small Cap Growth Alpha ETF,Y
JSPR,NASDAQ,"Jasper Therapeutics, Inc. - Class A Common Stock",N
JSPRW,NASDAQ,"Jasper Therapeutics, Inc. - Warrant",N
JSTC,NYSE Arca,Adasina Social Justice All Cap Global ETF,Y
JTAI,NASDAQ,Jet.AI Inc. - Common Stock,N
JTEK,NASDAQ,JPMorgan U.S. Tech Leaders ETF,Y
JUNS,NASDAQ,"Jupiter Neurosciences, Inc. - Common Stock",N
JUSA,NYSE Arca,JPMorgan U.S. Research Enhanced Large Cap ETF,Y
JUST,NYSE Arca,Goldman Sachs JUST U.S. Large Cap Equity ETF,Y
JVA,NASDAQ,"Coffee Holding Co., Inc. - Common Stock",N
JVAL,NYSE Arca,JPMorgan U.S. Value Factor ETF,Y
JWEL,NASDAQ,Jowell Global Ltd. - Ordinary Shares,N
JXG,NASDAQ,JX Luxventure Group Inc. - Common Stock,N
JXI,NYSE Arca,iShares Global Utilities ETF,Y
JXN,NYSE,Jackson Financial Inc. Class A Common Stock,N
JXN$A,NYSE,"Jackson Financial Inc. Depositary Shares, each representing a 1/1,000th interest in a share of Fixed-Rate Reset Noncumulative Perpetual Preferred Stock, Series A",N
JYD,NASDAQ,Jayud Global Logistics Limited - Class A Ordinary Shares,N
JYNT,NASDAQ,The Joint Corp. - Common Stock,N
JZ,NASDAQ,Jianzhi Education Technology Group Company Limited - American Depositary Shares,N
JZXN,NASDAQ,"Jiuzi Holdings, Inc. - Ordinary Shares",N
KAI,NYSE,Kadant Inc Common Stock,N
KALA,NASDAQ,"KALA BIO, Inc. - Common Stock",N
KALU,NASDAQ,Kaiser Aluminum Corporation - Common Stock,N
KALV,NASDAQ,"KalVista Pharmaceuticals, Inc. - Common Stock",N
KAPA,NYSE American,"Kairos Pharma, Ltd. Common Stock",N
KARO,NASDAQ,Karooooo Ltd. - Ordinary shares,N
KARS,NYSE Arca,KraneShares Electric Vehicles and Future Mobility Index ETF,Y
KAT,NASDAQ,Scharf ETF,Y
KB,NYSE,KB Financial Group Inc,N
KBA,NYSE Arca,KraneShares Bosera MSCI China A 50 Connect Index ETF,Y
KBAB,NASDAQ,KraneShares 2x Long BABA Daily ETF,Y
KBDC,NYSE,"Kayne Anderson BDC, Inc. Common Stock",N
KBDU,NASDAQ,KraneShares 2x Long BIDU Daily ETF,Y
KBE,NYSE Arca,State Street SPDR S&P Bank ETF,Y
KBFR,NYSE Arca,Innovator U.S. Small Cap Managed 10 Buffer ETF,Y
KBH,NYSE,KB Home Common Stock,N
