ticker,exchange,security_name,is_etf
QTUM,NASDAQ,Defiance Quantum ETF,Y
QTWO,NYSE,"Q2 Holdings, Inc. Common Stock",N
QUAD,NYSE,"Quad Graphics, Inc Class A Common Stock",N
QUBT,NASDAQ,Quantum Computing Inc. - Common Stock,N
QUCY,NASDAQ,Quantum Cyber N.V. - Ordinary Shares,N
QUIK,NASDAQ,QuickLogic Corporation - Common Stock,N
QUIZ,NYSE Arca,Zacks Quality International ETF,Y
QULL,NYSE Arca,ETRACS 2x Leveraged MSCI US Quality Factor TR ETN,Y
QUMS,NASDAQ,Quantumsphere Acquisition Corp. - Ordinary Shares,N
QUMSR,NASDAQ,Quantumsphere Acquisition Corp. - Rights,N
QUMSU,NASDAQ,Quantumsphere Acquisition Corp. - Units,N
QURE,NASDAQ,uniQure N.V. - Ordinary Shares,N
QUS,NYSE Arca,State Street SPDR MSCI USA StrategicFactors ETF,Y
QUSA,NYSE Arca,VistaShares Target 15 USA Quality Income ETF,Y
QVAL,NASDAQ,Alpha Architect U.S. Quantitative Value ETF,Y
QVML,NYSE Arca,Invesco S&P 500 QVM Multi-factor ETF,Y
QVMM,NYSE Arca,Invesco S&P MidCap 400 QVM Multi-factor ETF,Y
QVMS,NYSE Arca,Invesco S&P SmallCap 600 QVM Multi-factor ETF,Y
QVMT,NYSE Arca,Invesco S&P 500 Concentrated QVM ETF,Y
QWLD,NYSE Arca,State Street SPDR MSCI World StrategicFactors ETF,Y
QXL,NASDAQ,Quantum X Labs Inc. - Common Stock,N
QXO,NYSE,"QXO, Inc. Common Stock",N
QXO$B,NYSE,"QXO, Inc.  Depositary Shares, each representing a 1/20th interest in a share of 5.50% Series B Mandatory Convertible Preferred Stock",N
QXQ,NASDAQ,SGI Enhanced Nasdaq-100 ETF,Y
QYLD,NASDAQ,Global X NASDAQ 100 Covered Call ETF,Y
QYLG,NASDAQ,Global X Nasdaq 100 Covered Call & Growth ETF,Y
R,NYSE,"Ryder System, Inc. Common Stock",N
RA,NYSE,Brookfield Real Assets Income Fund Inc. Common Stock,N
RAA,NASDAQ,SMI 3Fourteen REAL Asset Allocation ETF,Y
RAAA,NYSE Arca,Reckoner Yield Enhanced AAA CLO ETF,Y
RAAQ,NASDAQ,Real Asset Acquisition Corp. - Class A Ordinary Share,N
RAAQU,NASDAQ,Real Asset Acquisition Corp. - Unit,N
RAAQW,NASDAQ,Real Asset Acquisition Corp. - Warrants,N
RAAR,NYSE Arca,Reckoner Yield Enhanced AAA CLO Reinvesting ETF,Y
RAAX,NYSE Arca,VanEck Real Assets ETF,Y
RAAY,NYSE Arca,Reckoner Yield Enhanced AAA CLO Annual ETF,Y
RAC,NYSE,Rithm Acquisition Corp. Class A Ordinary Shares,N
RAC.U,NYSE,Rithm Acquisition Corp. Units (each consists of one Class A Ordinary Share and one-third of one redeemable Warrant),N
RAC.W,NYSE,"Rithm Acquisition Corp. Redeemable warrants, each whole warrant exercisable for one Class A ordinary share at an exercise price of $11.50",N
RACE,NYSE,Ferrari N.V. Common Shares,N
RADX,NASDAQ,Radiopharm Theranostics Limited - American Depositary Shares,N
RAFE,NYSE Arca,PIMCO RAFI ESG U.S. ETF,Y
RAIL,NASDAQ,"Freightcar America, Inc. - Common Stock",N
RAIN,NASDAQ,"Rain Enhancement Technologies Holdco, Inc. - Class A Common Stock",N
RAINW,NASDAQ,"Rain Enhancement Technologies Holdco, Inc. - Warrants",N
RAL,NYSE,Ralliant Corporation Common Stock,N
RAMP,NYSE,"LiveRamp Holdings, Inc. Common Stock",N
RAND,NASDAQ,Rand Capital Corporation - Closed End Fund,N
RANG,NASDAQ,Range Capital Acquisition Corp. - Ordinary Shares,N
RANGR,NASDAQ,Range Capital Acquisition Corp. - Rights,N
RANGU,NASDAQ,Range Capital Acquisition Corp. - Units,N
RANI,NASDAQ,"Rani Therapeutics Holdings, Inc. - Class A Common Stock",N
RAPP,NASDAQ,"Rapport Therapeutics, Inc. - Common Stock",N
RARE,NASDAQ,Ultragenyx Pharmaceutical Inc. - Common Stock,N
RAUS,NASDAQ,RACWI US ETF,Y
RAVE,NASDAQ,"Rave Restaurant Group, Inc. - Common Stock",N
RAVI,NYSE Arca,FlexShares Ultra-Short Income Fund,Y
RAY,NASDAQ,Raytech Holding Limited - Ordinary Shares,N
RAYA,NASDAQ,Erayak Power Solution Group Inc. - Class A Ordinary Shares,N
RAYJ,NYSE Arca,Rayliant SMDAM Japan Equity ETF,Y
RBA,NYSE,"RB Global, Inc. Common Stock",N
RBB,NASDAQ,RBB Bancorp - Common Stock,N
RBBN,NASDAQ,Ribbon Communications Inc.  - Common Stock,N
RBC,NYSE,RBC Bearings Incorporated Common Stock,N
RBCAA,NASDAQ,"Republic Bancorp, Inc. - Class A Common Stock",N
RBIL,NASDAQ,F/m Ultrashort Treasury Inflation-Protected Security (TIPS) ETF,Y
RBKB,NASDAQ,"Rhinebeck Bancorp, Inc. - Common Stock",N
RBLD,NYSE Arca,First Trust Alerian US NextGen Infrastructure ETF,Y
RBLX,NYSE,Roblox Corporation Class A Common Stock,N
RBLY,NYSE Arca,YieldMax RBLX Option Income Strategy ETF,Y
RBNE,NASDAQ,Robin Energy Ltd. - Common Stock,N
RBRK,NYSE,"Rubrik, Inc. Class A Common Stock",N
RC,NYSE,Ready Capital Corporation Common Stock,N
RC$C,NYSE,Ready Capital Corporation 6.25% Series C Cumulative Convertible Preferred Stock,N
RC$E,NYSE,Ready Capital Corporation 6.50% Series E Cumulative Redeemable Preferred Stock,N
RCAT,NASDAQ,"Red Cat Holdings, Inc. - Common Stock",N
RCAX,NASDAQ,Defiance Daily Target 2x Long RCAT ETF,Y
RCD,NYSE,Ready Capital Corporation 9.00% Senior Notes due 2029,N
RCEL,NASDAQ,"Avita Medical, Inc. - Common Stock",N
RCG,NYSE American,"RENN Fund, Inc Common Stock",N
RCGE,NASDAQ,RockCreek Global Equality ETF,Y
RCI,NYSE,"Rogers Communication, Inc. Common Stock",N
RCKT,NASDAQ,"Rocket Pharmaceuticals, Inc. - Common Stock",N
RCKTW,NASDAQ,"Rocket Pharmaceuticals, Inc. - Warrant",N
RCKY,NASDAQ,"Rocky Brands, Inc. - Common Stock",N
RCL,NYSE,Royal Caribbean Cruises Ltd. Common Stock,N
RCLO,NYSE Arca,Reckoner BBB-B CLO ETF,Y
RCLR,NYSE Arca,Reckoner BBB-B CLO Reinvesting ETF,Y
RCLY,NYSE Arca,Reckoner BBB-B CLO Annual ETF,Y
RCMT,NASDAQ,"RCM Technologies, Inc. - Common Stock",N
RCON,NASDAQ,"Recon Technology, Ltd. - Class A Ordinary Shares",N
RCS,NYSE,"PIMCO Strategic Income Fund, Inc.",N
RCT,NASDAQ,RedCloud Holdings plc - Ordinary Shares,N
RCTR,NYSE Arca,First Trust Bloomberg Nuclear Power ETF,Y
RCUS,NYSE,"Arcus Biosciences, Inc. Common Stock",N
RDAC,NASDAQ,Rising Dragon Acquisition Corp. - Ordinary Shares,N
RDACR,NASDAQ,Rising Dragon Acquisition Corp. - Rights,N
RDACU,NASDAQ,Rising Dragon Acquisition Corp. - Unit,N
RDAG,NASDAQ,Republic Digital Acquisition Company - Class A Ordinary Shares,N
RDAGU,NASDAQ,Republic Digital Acquisition Company - Unit,N
RDAGW,NASDAQ,Republic Digital Acquisition Company - Warrants,N
RDCM,NASDAQ,Radcom Ltd. - Ordinary Shares,N
RDDT,NYSE,"Reddit, Inc. Class A Common Stock",N
RDGT,NASDAQ,"Ridgetech, Inc. - Ordinary Shares",N
RDHL,NASDAQ,Redhill Biopharma Ltd. - American Depositary Shares,N
RDI,NASDAQ,Reading International Inc - Class A Non-voting Common Stock,N
RDIB,NASDAQ,Reading International Inc - Class B Voting Common Stock,N
RDIV,NYSE Arca,Invesco S&P Ultra Dividend Revenue ETF,Y
RDN,NYSE,Radian Group Inc. Common Stock,N
RDNT,NASDAQ,"RadNet, Inc. - Common Stock",N
RDNW,NASDAQ,"RideNow Group, Inc. - Class B Common Stock",N
RDOG,NYSE Arca,ALPS REIT Dividend Dogs ETF,Y
RDTL,NASDAQ,GraniteShares 2x Long RDDT Daily ETF,Y
RDTY,NASDAQ,YieldMax R2000 0DTE Covered Strategy ETF,Y
RDVT,NASDAQ,"Red Violet, Inc. - Common Stock",N
RDVY,NASDAQ,First Trust Rising Dividend Achievers ETF,Y
RDW,NYSE,Redwire Corporation Common Stock,N
RDWR,NASDAQ,Radware Ltd. - Ordinary Shares,N
RDY,NYSE,Dr. Reddy's Laboratories Ltd Common Stock,N
RDYY,NYSE Arca,YieldMax RDDT Option Income Strategy ETF,Y
RDZN,NASDAQ,"Roadzen, Inc. - Ordinary Shares",N
RDZNW,NASDAQ,"Roadzen, Inc. - Warrants",N
REAI,NASDAQ,Intelligent Real Estate ETF,Y
REAL,NASDAQ,"The RealReal, Inc. - Common Stock",N
REAX,NASDAQ,"The Real Brokerage, Inc. - Common Shares",N
REBN,NASDAQ,"Reborn Coffee, Inc. - Common Stock",N
RECS,NYSE Arca,Columbia Research Enhanced Core ETF,Y
RECT,NASDAQ,Rectitude Holdings Ltd - Ordinary Shares,N
REE,NASDAQ,REE Automotive Ltd. - Class A Ordinary Shares,N
REED,NYSE American,"Reed's, Inc. Common Stock",N
REET,NYSE Arca,iShares Global REIT ETF,Y
REFA,NYSE Arca,Columbia Research Enhanced International Equity ETF,Y
REFI,NASDAQ,"Chicago Atlantic Real Estate Finance, Inc. - Common Stock",N
REFR,NASDAQ,Research Frontiers Incorporated - Common Stock,N
REG,NASDAQ,Regency Centers Corporation - Common Stock,N
REGCO,NASDAQ,Regency Centers Corporation - 5.875% Series B Cumulative Redeemable Preferred Stock,N
REGCP,NASDAQ,Regency Centers Corporation - 6.25% Series A Cumulative Redeemable Preferred Stock,N
REGN,NASDAQ,"Regeneron Pharmaceuticals, Inc. - Common Stock",N
REGS,NYSE Arca,Columbia Large Cap Growth ETF,Y
REI,NYSE American,"Ring Energy, Inc. Common Stock",N
REIT,NASDAQ,ALPS Active REIT ETF,Y
REK,NYSE Arca,ProShares Short Real Estate,Y
REKR,NASDAQ,"Rekor Systems, Inc. - Common Stock",N
RELL,NASDAQ,"Richardson Electronics, Ltd. - Common Stock",N
RELX,NYSE,RELX PLC PLC American Depositary Shares (Each representing One Ordinary Share),N
RELY,NASDAQ,"Remitly Global, Inc. - Common stock",N
REMC,NYSE Arca,Columbia Research Enhanced Mid Cap ETF,Y
REMG,NASDAQ,Russell Investments Emerging Markets Equity ETF,Y
REMX,NYSE Arca,VanEck Rare Earth and Strategic Metals ETF,Y
RENT,NASDAQ,"Rent the Runway, Inc. - Class A Common Stock",N
RENX,NASDAQ,RenX Enterprises Corp. - Common Stock,N
REPL,NASDAQ,"Replimune Group, Inc. - Common Stock",N
REPX,NYSE American,"Riley Exploration Permian, Inc. Common Stock",N
RERE,NYSE,ATRenew Inc. American Depositary Shares (every three of which representing two Class A ordinary shares),N
RES,NYSE,"RPC, Inc. Common Stock",N
RESM,NYSE Arca,Columbia Research Enhanced Small Cap ETF,Y
RETL,NYSE Arca,Direxion Daily Retail Bull 3X ETF,Y
RETO,NASDAQ,"ReTo Eco-Solutions, Inc. - Class A Shares",N
REVB,NASDAQ,"Revelation Biosciences, Inc. - Common Stock",N
REVBW,NASDAQ,"Revelation Biosciences, Inc. - Warrant",N
REVS,NYSE Arca,Columbia Research Enhanced Value ETF,Y
REW,NYSE Arca,ProShares UltraShort Technology,Y
REX,NYSE,REX American Resources Corporation,N
REXC,NASDAQ,Sprott Rare Earths Ex-China ETF,Y
REXR,NYSE,"Rexford Industrial Realty, Inc. Common Stock",N
REXR$B,NYSE,"Rexford Industrial Realty, Inc. 5.875% Series B Cumulative Redeemable Preferred Stock",N
REXR$C,NYSE,"Rexford Industrial Realty, Inc. 5.625% Series C Cumulative Redeemable Preferred Stock, par value $0.01 per share",N
REYN,NASDAQ,Reynolds Consumer Products Inc. - Common Stock,N
REZ,NYSE Arca,iShares Residential and Multisector Real Estate ETF,Y
REZI,NYSE,"Resideo Technologies, Inc. Common Stock",N
RF,NYSE,Regions Financial Corporation Common Stock,N
RF$C,NYSE,"Regions Financial Corporation Depositary Shares, each Representing a 1/40th Interest in a  Share of 5.700% Fixed-to-Floating Rate Non-Cumulative  Perpetual Preferred Stock, Series C",N
RF$E,NYSE,"Regions Financial Corporation Depositary Shares, Each Representing a 1/40th Interest in a Share of 4.45% Non-Cumulative Perpetual Preferred Stock, Series E",N
RF$F,NYSE,"Regions Financial Corporation Depositary Shares Each Representing a 1/40th Interest in a Share of Non-Cumulative Perpetual Preferred Stock, Series F",N
RFAI,NASDAQ,RF Acquisition Corp II - Ordinary Shares,N
RFAIR,NASDAQ,RF Acquisition Corp II - Right,N
RFAIU,NASDAQ,RF Acquisition Corp II - Unit,N
RFAM,NASDAQ,RF Acquisition Corp III - Ordinary Shares,N
RFAMR,NASDAQ,RF Acquisition Corp III - Rights,N
RFAMU,NASDAQ,RF Acquisition Corp III - Units,N
RFCI,NYSE Arca,ALPS Dynamic Core Income ETF,Y
RFDA,NYSE Arca,ALPS Dynamic US Dividend Advantage ETF,Y
RFDI,NASDAQ,First Trust RiverFront Dynamic Developed International ETF,Y
RFEM,NASDAQ,First Trust RiverFront Dynamic Emerging Markets ETF,Y
RFFC,NYSE Arca,ALPS Active Equity Opportunity ETF,Y
RFG,NYSE Arca,Invesco S&P MidCap 400 Pure Growth ETF,Y
RFI,NYSE,"Cohen & Steers Total Return Realty Fund, Inc. Common Stock",N
RFIL,NASDAQ,"RF Industries, Ltd. - Common Stock",N
RFIX,NYSE Arca,Simplify Bond Bull ETF,Y
RFL,NYSE,"Rafael Holdings, Inc. Class B Common Stock",N
RFLR,NYSE Arca,Innovator U.S. Small Cap Managed Floor ETF,Y
RFM,NYSE,"RiverNorth Flexible Municipal Income Fund, Inc. Common Stock",N
RFMZ,NYSE,"RiverNorth Flexible Municipal Income Fund II, Inc. Common Stock",N
RFV,NYSE Arca,Invesco S&P MidCap 400 Pure Value ETF,Y
RGA,NYSE,"Reinsurance Group of America, Incorporated Common Stock",N
RGC,NASDAQ,Regencell Bioscience Holdings Limited - Ordinary Shares,N
RGCO,NASDAQ,RGC Resources Inc. - Common Stock,N
RGEF,NYSE Arca,Rockefeller Global Equity ETF,Y
RGEN,NASDAQ,Repligen Corporation - Common Stock,N
RGLD,NASDAQ,"Royal Gold, Inc. - Common Stock",N
RGLO,NASDAQ,Russell Investments Global Equity ETF,Y
RGNT,NYSE American,Regentis Biomaterials Ltd. Ordinary Shares,N
RGNX,NASDAQ,REGENXBIO Inc. - Common Stock,N
RGP,NASDAQ,"Resources Connection, Inc. - Common Stock",N
RGR,NYSE,"Sturm, Ruger & Company, Inc. Common Stock",N
RGS,NASDAQ,Regis Corporation - Common Stock,N
RGT,NYSE,"Royce Global Trust, Inc. Common Stock",N
RGTI,NASDAQ,"Rigetti Computing, Inc.  - Common stock",N
RGTIW,NASDAQ,"Rigetti Computing, Inc.  - Redeemable warrants, each whole warrant exercisable for one Class A ordinary share at an exercise price of $11.50",N
RGTX,NASDAQ,Defiance Daily Target 2X Long RGTI ETF,Y
RGTZ,NASDAQ,Defiance Daily Target 2x Short RGTI ETF,Y
RGYY,NASDAQ,GraniteShares YieldBoost RGTI ETF,Y
RH,NYSE,RH Common Stock,N
RHI,NYSE,Robert Half Inc. Common Stock,N
RHLD,NYSE,Resolute Holdings Management Common Stock,N
RHP,NYSE,"Ryman Hospitality Properties, Inc. (REIT)",N
RHRX,NYSE Arca,RH Tactical Rotation ETF,Y
RHTX,NYSE Arca,RH Tactical Outlook ETF,Y
RIBB,NASDAQ,Ribbon Acquisition Corp - Class A Ordinary Shares,N
RIBBR,NASDAQ,Ribbon Acquisition Corp - Rights,N
RIBBU,NASDAQ,Ribbon Acquisition Corp - Unit,N
RICK,NASDAQ,"RCI Hospitality Holdings, Inc. - Common Stock",N
RIET,NYSE Arca,Hoya Capital High Dividend Yield ETF,Y
RIFR,NASDAQ,Russell Investments Global Infrastructure ETF,Y
RIG,NYSE,Transocean Ltd (Switzerland) Common Stock,N
RIGL,NASDAQ,"Rigel Pharmaceuticals, Inc. - Common Stock",N
RIGS,NYSE Arca,RiverFront Strategic Income Fund,Y
RILA,NYSE Arca,Indexperts Gorilla Aggressive Growth ETF,Y
RILY,NASDAQ,"BRC Group Holdings, Inc. - Common Stock",N
RILYG,NASDAQ,"BRC Group Holdings, Inc. - 5.00% Senior Notes due 2026",N
RILYL,NASDAQ,"BRC Group Holdings, Inc. - Depositary Shares, each representing a 1/1000th fractional interest in a share of Series B Cumulative Perpetual Preferred Stock",N
RILYN,NASDAQ,"BRC Group Holdings, Inc. - 6.50% Senior Notes Due 2026",N
RILYP,NASDAQ,"BRC Group Holdings, Inc. - Depositary Shares, each representing a 1/1000th fractional interest in a share of Series A Cumulative Perpetual Preferred Stock",N
RILYT,NASDAQ,"BRC Group Holdings, Inc. - 6.00% Senior Notes Due 2028",N
RILYZ,NASDAQ,"BRC Group Holdings, Inc. - 5.25% Senior Notes due 2028",N
RIME,NASDAQ,"Algorhythm Holdings, Inc. - Common Stock",N
RINF,NYSE Arca,ProShares Inflation Expectations ETF,Y
RING,NASDAQ,iShares MSCI Global Gold Miners ETF,Y
RINT,NASDAQ,Russell Investments International Developed Equity ETF,Y
RIO,NYSE,Rio Tinto Plc Common Stock,N
RIOT,NASDAQ,"Riot Platforms, Inc. - Common Stock",N
RIOX,NYSE Arca,Defiance Daily Target 2X Long RIOT ETF,Y
RISE,NYSE Arca,Pictet Emerging Markets Rising Economies ETF,Y
RISN,NYSE Arca,Inspire Capital Appreciation ETF,Y
RISR,NYSE Arca,FolioBeyond Alternative Income and Interest Rate Hedge ETF,Y
RITA,NYSE Arca,ETFB Green SRI REITs ETF,Y
RITM,NYSE,Rithm Capital Corp. Common Stock,N
RITM$A,NYSE,Rithm Capital Corp. 7.50% Series A Fixed-to-Floating Rate Cumulative Redeemable Preferred Stock,N
RITM$B,NYSE,Rithm Capital Corp. 7.125% Series B Fixed-to-Floating Rate Cumulative Redeemable Preferred Stock,N
RITM$C,NYSE,Rithm Capital Corp. 6.375% Series C Fixed-to-Floating Rate Cumulative Redeemable Preferred Stock,N
RITM$D,NYSE,Rithm Capital Corp. 7.00% Fixed-Rate Reset Series D Cumulative Redeemable Preferred Stock,N
RITM$E,NYSE,Rithm Capital Corp. 8.75% Series E Fixed-Rate Cumulative Redeemable Preferred Stock,N
RITM$F,NYSE,Rithm Capital Corp. 8.750% Series F Fixed-Rate Reset Cumulative Redeemable Preferred Stock,N
RITR,NASDAQ,Reitar Logtech Holdings Limited - Ordinary shares,N
RIV,NYSE,"RiverNorth Opportunities Fund, Inc. Common Stock",N
RIV$A,NYSE,"RiverNorth Opportunities Fund, Inc. 6.00% Series A Perpetual Preferred Stock",N
RIVN,NASDAQ,"Rivian Automotive, Inc. - Class A Common Stock",N
RJDI,NYSE Arca,RJ Eagle GCM Dividend Select Income ETF,Y
RJET,NASDAQ,Republic Airways Holdings Inc. - Common Stock,N
RJF,NYSE,"Raymond James Financial, Inc. Common Stock",N
RJMI,NYSE Arca,RJ Eagle Municipal Income ETF,Y
RJVI,NYSE Arca,RJ Eagle Vertical Income ETF,Y
RKDA,NASDAQ,"Arcadia Biosciences, Inc. - Common Stock",N
RKLB,NASDAQ,Rocket Lab Corporation - Common Stock,N
RKLX,NASDAQ,Defiance Daily Target 2X Long RKLB ETF,Y
RKLZ,NASDAQ,Defiance Daily Target 2x Short RKLB ETF,Y
RKNG,NASDAQ,Defiance Retail Kings ETF,Y
RKSG,NYSE Arca,Ruk Strategic Growth ETF,Y
RKT,NYSE,"Rocket Companies, Inc. Class A Common Stock",N
RL,NYSE,Ralph Lauren Corporation Common Stock,N
RLAY,NASDAQ,"Relay Therapeutics, Inc. - Common Stock",N
RLGT,NYSE American,"Radiant Logistics, Inc. Common Stock",N
RLI,NYSE,RLI Corp. Common Stock (DE),N
RLJ,NYSE,RLJ Lodging Trust Common Shares of Beneficial Interest $0.01 par value,N
RLJ$A,NYSE,RLJ Lodging Trust $1.95 Series A Cumulative Convertible  Preferred Shares,N
RLMD,NASDAQ,"Relmada Therapeutics, Inc. - Common Stock",N
RLTY,NYSE,Cohen & Steers Real Estate Opportunities and Income Fund Common Shares of Beneficial Interest,N
RLX,NYSE,"RLX Technology Inc. American Depositary Shares, each representing the right to receive one (1) Class A ordinary share",N
RLY,NYSE Arca,State Street Multi-Asset Real Return ETF,Y
RLYB,NASDAQ,Rallybio Corporation - Common Stock,N
RM,NYSE,Regional Management Corp. Common Stock,N
RMAX,NYSE,"RE/MAX Holdings, Inc. Class A Common Stock",N
RMBI,NASDAQ,"Richmond Mutual Bancorporation, Inc. - Common Stock",N
RMBS,NASDAQ,"Rambus, Inc. - Common Stock",N
RMCA,NYSE Arca,Rockefeller California Municipal Bond ETF,Y
RMCF,NASDAQ,"Rocky Mountain Chocolate Factory, Inc. - Common Stock",N
RMCO,NASDAQ,Royalty Management Holding Corporation - Class A Common Stock,N
RMCOW,NASDAQ,Royalty Management Holding Corporation - Warrant,N
RMD,NYSE,ResMed Inc. Common Stock,N
RMI,NYSE,"RiverNorth Opportunistic Municipal Income Fund, Inc. Common Stock",N
RMIX,NASDAQ,"Suncrete, Inc. - Class A Common Stock",N
RMM,NYSE,"RiverNorth Managed Duration Municipal Income Fund, Inc. Common Stock",N
RMMZ,NYSE,"RiverNorth Managed Duration Municipal Income Fund II, Inc. Common Stock",N
RMNI,NASDAQ,"Rimini Street, Inc. - Common Stock",N
RMNY,NYSE Arca,Rockefeller New York Municipal Bond ETF,Y
RMOP,NYSE Arca,Rockefeller Opportunistic Municipal Bond ETF,Y
RMR,NASDAQ,The RMR Group Inc. - Class A Common Stock,N
RMRC,NYSE Arca,ARMOR Core Risk-Managed ETF,Y
RMSG,NASDAQ,Real Messenger Corporation - Ordinary Shares,N
RMSGW,NASDAQ,Real Messenger Corporation - Warrants,N
RMT,NYSE,"Royce Micro-Cap Trust, Inc. Common Stock",N
RMTI,NASDAQ,"Rockwell Medical, Inc. - Common Stock",N
RNA,NASDAQ,"Atrium Therapeutics, Inc. - Common Stock",N
RNAC,NASDAQ,"Cartesian Therapeutics, Inc. - Common Stock",N
RNAZ,NASDAQ,"TransCode Therapeutics, Inc. - Common Stock",N
RND,NYSE Arca,First Trust Bloomberg R&D Leaders ETF,Y
RNEM,NASDAQ,Emerging Markets Equity Select ETF,Y
RNG,NYSE,"RingCentral, Inc. Class A Common Stock",N
RNGR,NYSE,"Ranger Energy Services, Inc. Class A Common Stock",N
RNGT,NASDAQ,Range Capital Acquisition Corp II - Class A Ordinary Shares,N
RNGTU,NASDAQ,Range Capital Acquisition Corp II - Units,N
RNGTW,NASDAQ,Range Capital Acquisition Corp II - Warrants,N
RNIN,NASDAQ,Bushido Capital US SMID Cap Equity ETF,Y
RNP,NYSE,"Cohen & Steers REIT and Preferred and Income Fund, Inc. Common Shares",N
RNR,NYSE,RenaissanceRe Holdings Ltd. Common Stock,N
RNR$F,NYSE,"RenaissanceRe Holdings Ltd. Depositary Shares, each Representing a 1/1,000th Interest in a 5.750% Series F Preference Share",N
RNR$G,NYSE,"RenaissanceRe Holdings Ltd. Depositary Shares, each representing a 1/1,000th interest in a share of 4.20% Series G Preference Shares",N
RNRG,NASDAQ,Global X Renewable Energy Producers ETF,Y
RNST,NYSE,Renasant Corporation Common Stock,N
RNTX,NASDAQ,"Rein Therapeutics, Inc. - Common Stock",N
RNTY,NYSE Arca,YieldMax Target 12 Real Estate Option Income ETF,Y
RNW,NASDAQ,ReNew Energy Global plc - Class A Shares,N
RNWWW,NASDAQ,ReNew Energy Global plc - Warrant,N
RNWZ,NYSE Arca,TrueShares Eagle Global Renewable Energy Income ETF,Y
RNXT,NASDAQ,"RenovoRx, Inc. - Common Stock",N
ROAD,NASDAQ,"Construction Partners, Inc. - Common Stock",N
ROAM,NYSE Arca,Hartford Multifactor Emerging Markets ETF,Y
ROBO,NYSE Arca,ROBO Global Robotics and Automation Index ETF,Y
ROBT,NASDAQ,First Trust Nasdaq Artificial Intelligence and Robotics ETF,Y
ROC,NASDAQ,Rank One Computing Corporation - Common stock,N
ROCK,NASDAQ,"Gibraltar Industries, Inc. - Common Stock",N
ROCQ,NASDAQ,JPMorgan Nasdaq Equity Premium Yield ETF,Y
ROCY,NASDAQ,JPMorgan Equity Premium Yield ETF,Y
RODM,NYSE Arca,Hartford Multifactor Developed Markets (ex-US) ETF,Y
ROE,NASDAQ,Astoria US Equal Weight Quality Kings ETF,Y
ROG,NYSE,Rogers Corporation Common Stock,N
ROIV,NASDAQ,Roivant Sciences Ltd. - Common Shares,N
ROK,NYSE,"Rockwell Automation, Inc. Common Stock",N
ROKT,NYSE Arca,State Street SPDR S&P Kensho Final Frontiers ETF,Y
ROKU,NASDAQ,"Roku, Inc. - Class A Common Stock",N
ROL,NYSE,"Rollins, Inc. Common Stock",N
ROLR,NYSE American,"High Roller Technologies, Inc. Common Stock",N
ROM,NYSE Arca,ProShares Ultra Technology,Y
ROMA,NASDAQ,Roma Green Finance Limited - Class A Ordinary Shares,N
RONB,NYSE,Baron First Principles ETF,Y
ROOT,NASDAQ,"Root, Inc. - Common Stock",N
ROP,NASDAQ,"Roper Technologies, Inc. - Common Stock",N
ROPE,NYSE Arca,Coastal Compass 100 ETF,Y
ROSC,NYSE Arca,Hartford Multifactor Small Cap ETF,Y
ROST,NASDAQ,"Ross Stores, Inc. - Common Stock",N
ROUS,NYSE Arca,Hartford Multifactor U.S. Equity ETF,Y
RPAR,NYSE Arca,RPAR Risk Parity ETF,Y
RPAY,NASDAQ,Repay Holdings Corporation - Class A Common Stock,N
RPC,NYSE,"Ridgepost Capital, Inc. Class A Common Stock",N
RPD,NASDAQ,"Rapid7, Inc. - Common Stock",N
RPG,NYSE Arca,Invesco S&P 500 Pure Growth ETF,Y
RPGL,NASDAQ,Republic Power Group Limited - Class A Ordinary Shares,N
RPID,NASDAQ,"Rapid Micro Biosystems, Inc. - Class A Common Stock",N
RPM,NYSE,RPM International Inc. Common Stock,N
RPRX,NASDAQ,Royalty Pharma plc - Class A Ordinary Shares,N
RPT,NYSE,Rithm Property Trust Inc. Common stock,N
RPT$C,NYSE,Rithm Property Trust Inc. 9.875% Series C Fixed-to-Floating Rate Cumulative Redeemable Preferred Stock,N
RPV,NYSE Arca,Invesco S&P 500 Pure Value ETF,Y
RQI,NYSE,Cohen & Steers Quality Income Realty Fund Inc Common Shares,N
RR,NASDAQ,Richtech Robotics Inc. - Class B Common Stock,N
RRBI,NASDAQ,"Red River Bancshares, Inc. - Common Stock",N
RRC,NYSE,Range Resources Corporation Common Stock,N
RREVU,NASDAQ,RRE Ventures Acquisition Corp. - Units,N
RRGB,NASDAQ,"Red Robin Gourmet Burgers, Inc. - Common Stock",N
RRR,NASDAQ,"Red Rock Resorts, Inc. - Class A Common Stock",N
RRX,NYSE,Regal Rexnord Corporation Common Stock,N
RS,NYSE,"Reliance, Inc. Common Stock",N
RSDE,NYSE Arca,FT Vest U.S. Equity Equal Weight Buffer ETF - December,Y
RSF,NYSE,RiverNorth Capital and Income Fund Common Stock,N
RSG,NYSE,"Republic Services, Inc. Common Stock",N
RSHO,NYSE Arca,Tema American Reshoring ETF,Y
RSI,NYSE,"Rush Street Interactive, Inc. Class A Common Stock",N
RSJN,NYSE Arca,FT Vest U.S. Equity Equal Weight Buffer ETF - June,Y
RSKD,NYSE,Riskified Ltd. Class A Ordinary Shares,N
RSMC,NYSE Arca,Rockefeller U.S. Small-Mid Cap ETF,Y
RSMR,NYSE Arca,FT Vest U.S. Equity Equal Weight Buffer ETF - March,Y
RSMV,NYSE Arca,Relative Strength Managed Volatility Strategy ETF,Y
RSP,NYSE Arca,Invesco S&P 500 Equal Weight ETF,Y
RSPA,NYSE Arca,Invesco S&P 500 Equal Weight Income Advantage ETF,Y
RSPC,NYSE Arca,Invesco S&P 500 Equal Weight Communication Services ETF,Y
RSPD,NYSE Arca,Invesco S&P 500 Equal Weight Consumer Discretionary ETF,Y
RSPE,NYSE Arca,Invesco ESG S&P 500 Equal Weight ETF,Y
RSPF,NYSE Arca,Invesco S&P 500 Equal Weight Financial ETF,Y
RSPG,NYSE Arca,Invesco S&P 500 Equal Weight Energy ETF,Y
RSPH,NYSE Arca,Invesco S&P 500 Equal Weight Health Care ETF,Y
RSPM,NYSE Arca,Invesco S&P 500 Equal Weight Materials ETF,Y
RSPN,NYSE Arca,Invesco S&P 500 Equal Weight Industrials Portfolio,Y
RSPR,NYSE Arca,Invesco S&P 500 Equal Weight Real Estate ETF,Y
RSPS,NYSE Arca,Invesco S&P 500 Equal Weight Consumer Staples ETF,Y
RSPT,NYSE Arca,Invesco S&P 500 Equal Weight Technology ETF,Y
RSPU,NYSE Arca,Invesco S&P 500 Equal Weight Utilities ETF,Y
RSSE,NYSE Arca,FT Vest U.S. Equity Equal Weight Buffer ETF  September,Y
RSSL,NYSE Arca,Global X Russell 2000 ETF,Y
RSSS,NASDAQ,"Research Solutions, Inc - Common Stock",N
RSVR,NASDAQ,"Reservoir Media, Inc.. - Common Stock",N
RSVRW,NASDAQ,"Reservoir Media, Inc.. - Warrant",N
RTAC,NASDAQ,Renatus Tactical Acquisition Corp I - Class A Ordinary Shares,N
RTACU,NASDAQ,Renatus Tactical Acquisition Corp I - Unit,N
RTACW,NASDAQ,Renatus Tactical Acquisition Corp I - Warrant,N
RTH,NASDAQ,VanEck Retail ETF,Y
RTO,NYSE,Rentokil Initial plc American Depositary Shares (each representing five (5) Ordinary Shares),N
RTX,NYSE,RTX Corporation Common Stock,N
RTXG,NASDAQ,Leverage Shares 2X Long RTX Daily ETF,Y
RTYY,NASDAQ,GraniteShares YieldBoost RIOT ETF,Y
RUBI,NASDAQ,Rubico Inc. - Common Stock,N
RUM,NASDAQ,Rumble Inc. - Class A Common Stock,N
RUMBW,NASDAQ,Rumble Inc. - Warrant,N
RUN,NASDAQ,Sunrun Inc. - Common Stock,N
RUNN,NASDAQ,Running Oak Efficient Growth ETF,Y
RUSC,NASDAQ,Russell Investments U.S. Small Cap Equity ETF,Y
RUSHA,NASDAQ,"Rush Enterprises, Inc. - Class A Common Stock",N
RUSHB,NASDAQ,"Rush Enterprises, Inc. - Class B Common Stock",N
RVER,NYSE Arca,Trenchless Fund ETF,Y
RVI,NYSE,Robinhood Ventures Fund I Common Shares of Beneficial Interest,N
RVLV,NYSE,"Revolve Group, Inc. Class A Common Stock",N
RVMD,NASDAQ,"Revolution Medicines, Inc. - Common Stock",N
RVMDW,NASDAQ,"Revolution Medicines, Inc. - Warrant",N
RVNL,NASDAQ,GraniteShares 2x Long RIVN Daily ETF,Y
RVNU,NYSE Arca,Xtrackers Municipal Infrastructure Revenue Bond ETF,Y
RVP,NYSE American,"Retractable Technologies, Inc. Common Stock",N
RVPH,NASDAQ,"Reviva Pharmaceuticals Holdings, Inc. - Common Stock",N
RVSB,NASDAQ,Riverview Bancorp Inc - Common Stock,N
RVSN,NASDAQ,Rail Vision Ltd. - Ordinary Shares,N
RVSNW,NASDAQ,Rail Vision Ltd. - Warrant,N
RVT,NYSE,"Royce Small-Cap Trust, Inc. Common Stock",N
