ticker,exchange,security_name,is_etf
DDI,NASDAQ,"DoubleDown Interactive Co., Ltd. - American Depository Shares",N
DDIV,NASDAQ,First Trust Dorsey Wright Momentum & Dividend ETF,Y
DDL,NYSE,Dingdong (Cayman) Limited American Depositary Shares (each two representing three Ordinary Shares),N
DDM,NYSE Arca,ProShares Ultra Dow30,Y
DDOG,NASDAQ,"Datadog, Inc. - Class A Common Stock",N
DDS,NYSE,"Dillard's, Inc. Common Stock",N
DDT,NYSE,Dillard's Capital Trust I,N
DE,NYSE,Deere & Company Common Stock,N
DEA,NYSE,"Easterly Government Properties, Inc. Common Stock",N
DEC,NYSE,Diversified Energy Company Common Stock,N
DECK,NYSE,Deckers Outdoor Corporation Common Stock,N
DECO,NASDAQ,State Street Galaxy Digital Asset Ecosystem ETF,Y
DEED,NYSE Arca,First Trust Securitized Plus ETF,Y
DEEF,NYSE Arca,Xtrackers FTSE Developed ex US Multifactor ETF,Y
DEEP,NYSE Arca,Acquirers Small and Micro Deep Value ETF,Y
DEFI,NYSE Arca,Hashdex Bitcoin ETF,Y
DEFT,NASDAQ,"Defi Technologies, Inc. - Common Stock",N
DEHP,NYSE Arca,Dimensional Emerging Markets High Profitability ETF,Y
DEI,NYSE,"Douglas Emmett, Inc. Common Stock",N
DELL,NYSE,Dell Technologies Inc. Class C Common Stock,N
DEM,NYSE Arca,WisdomTree Emerging Markets High Dividend Fund,Y
DEMZ,NASDAQ,Democratic Large Cap Core ETF,Y
DEO,NYSE,Diageo plc Common Stock,N
DERM,NASDAQ,Journey Medical Corporation - Common Stock,N
DES,NYSE Arca,WisdomTree U.S. SmallCap Dividend Fund,Y
DESK,NYSE Arca,VanEck Office and Commercial REIT ETF,Y
DETX,NASDAQ,"Liberty Defense Holdings, Ltd. - Common Shares",N
DEUS,NYSE Arca,Xtrackers Russell US Multifactor ETF,Y
DEVS,NASDAQ,DevvStream Corp. - Common Stock,N
DEW,NYSE Arca,WisdomTree Global High Dividend Fund,Y
DEXC,NYSE Arca,Dimensional Emerging Markets ex China Core Equity ETF,Y
DFAC,NYSE Arca,Dimensional U.S. Core Equity 2 ETF,Y
DFAE,NYSE Arca,Dimensional Emerging Core Equity Market ETF,Y
DFAI,NYSE Arca,Dimensional International Core Equity Market ETF,Y
DFAR,NYSE Arca,Dimensional US Real Estate ETF,Y
DFAS,NYSE Arca,Dimensional U.S. Small Cap ETF,Y
DFAT,NYSE Arca,Dimensional U.S. Targeted Value ETF,Y
DFAU,NYSE Arca,Dimensional US Core Equity Market ETF,Y
DFAW,NYSE Arca,Dimensional World Equity ETF,Y
DFAX,NYSE Arca,Dimensional World ex U.S. Core Equity 2 ETF,Y
DFCA,NYSE Arca,Dimensional California Municipal Bond ETF,Y
DFCF,NYSE Arca,Dimensional Core Fixed Income ETF,Y
DFDV,NASDAQ,DeFi Development Corp. - Common Stock,N
DFDVW,NASDAQ,DeFi Development Corp. - Warrant,N
DFE,NYSE Arca,WisdomTree Europe SmallCap Dividend Fund,Y
DFEM,NYSE Arca,Dimensional Emerging Markets Core Equity 2 ETF,Y
DFEN,NYSE Arca,Direxion Daily Aerospace & Defense Bull 3X ETF,Y
DFEV,NYSE Arca,Dimensional Emerging Markets Value ETF,Y
DFGP,NASDAQ,Dimensional Global Core Plus Fixed Income ETF,Y
DFGR,NYSE Arca,Dimensional Global Real Estate ETF,Y
DFGX,NASDAQ,Dimensional International Core Fixed Income ETF,Y
DFH,NYSE,"Dream Finders Homes, Inc. Class A Common Stock",N
DFII,NYSE Arca,FT Vest Bitcoin Strategy & Target Income ETF,Y
DFIN,NYSE,"Donnelley Financial Solutions, Inc. Common Stock",N
DFIP,NYSE Arca,Dimensional Inflation-Protected Securities ETF,Y
DFIV,NYSE Arca,Dimensional International Value ETF,Y
DFJ,NYSE Arca,WisdomTree Japan SmallCap Fund,Y
DFLI,NASDAQ,Dragonfly Energy Holdings Corp - Common Stock,N
DFLIW,NASDAQ,Dragonfly Energy Holdings Corp - Warrant,N
DFLV,NYSE Arca,Dimensional US Large Cap Value ETF,Y
DFMC,NYSE Arca,U.S. Micro Cap Portfolio: ETF Class Shares,Y
DFNM,NYSE Arca,Dimensional National Municipal Bond ETF,Y
DFNS,NASDAQ,T3 Defense Inc. - Common Stock,N
DFNSW,NASDAQ,T3 Defense Inc. - Warrants,N
DFP,NYSE,Flaherty & Crumrine Dynamic Preferred and Income Fund Inc. Common Stock,N
DFSB,NYSE Arca,Dimensional Global Sustainability Fixed Income ETF,Y
DFSC,NASDAQ,"DEFSEC Technologies Inc. - common stock, no R/S concurrent with offering",N
DFSCW,NASDAQ,DEFSEC Technologies Inc. - warrant,N
DFSD,NYSE Arca,Dimensional Short-Duration Fixed Income ETF,Y
DFSE,NYSE Arca,Dimensional Emerging Markets Sustainability Core 1 ETF,Y
DFSI,NYSE Arca,Dimensional International Sustainability Core 1 ETF,Y
DFSU,NYSE Arca,Dimensional US Sustainability Core 1 ETF,Y
DFSV,NYSE Arca,Dimensional US Small Cap Value ETF,Y
DFTT,NYSE Arca,DF Tactical 30 ETF,Y
DFTX,NASDAQ,"Definium Therapeutics, Inc.  - Common Shares",N
DFUS,NYSE Arca,Dimensional U.S. Equity Market ETF,Y
DFUV,NYSE Arca,Dimensional US Marketwide Value ETF,Y
DFVE,NYSE Arca,DoubleLine Fortune 500 Equal Weight ETF,Y
DFVX,NYSE Arca,Dimensional US Large Cap Vector ETF,Y
DG,NYSE,Dollar General Corporation Common Stock,N
DGCB,NASDAQ,Dimensional Global Credit ETF,Y
DGICA,NASDAQ,"Donegal Group, Inc. - Class A Common Stock",N
DGICB,NASDAQ,"Donegal Group, Inc. - Class B Common Stock",N
DGII,NASDAQ,Digi International Inc. - Common Stock,N
DGIN,NYSE Arca,VanEck Digital India ETF,Y
DGLO,NASDAQ,First Trust RBA Deglobalization ETF,Y
DGNX,NASDAQ,Diginex Limited - Ordinary Shares,N
DGP,NYSE Arca,"DB Gold Double Long ETN due February 15, 2038",N
DGRE,NASDAQ,WisdomTree Emerging Markets Quality Dividend Growth Fund,Y
DGRO,NYSE Arca,iShares Core Dividend Growth ETF,Y
DGRS,NASDAQ,WisdomTree U.S. SmallCap Quality Dividend Growth Fund,Y
DGRW,NASDAQ,WisdomTree U.S. Quality Dividend Growth Fund,Y
DGS,NYSE Arca,WisdomTree Emerging Market SmallCap Fund,Y
DGT,NYSE Arca,State Street SPDR Global Dow ETF,Y
DGX,NYSE,Quest Diagnostics Incorporated Common Stock,N
DGXX,NASDAQ,Digi Power X Inc. - Common Subordinate Voting Shares,N
DGZ,NYSE Arca,"DB Gold Short ETN due February 15, 2038",N
DH,NASDAQ,Definitive Healthcare Corp. - Class A Common Stock,N
DHC,NASDAQ,Diversified Healthcare Trust  - Common Shares of Beneficial Interest,N
DHCNI,NASDAQ,Diversified Healthcare Trust  - 5.625% Senior Notes due 2042,N
DHCNL,NASDAQ,Diversified Healthcare Trust  - 6.25% Senior Notes Due 2046,N
DHF,NYSE,BNY Mellon High Yield Strategies Fund Common Stock,N
DHI,NYSE,"D.R. Horton, Inc. Common Stock",N
DHLX,NYSE Arca,Diamond Hill Large Cap Concentrated ETF,Y
DHR,NYSE,Danaher Corporation Common Stock,N
DHS,NYSE Arca,WisdomTree U.S. High Dividend Fund,Y
DHSB,NYSE Arca,Day Hagan Smart Buffer ETF,Y
DHT,NYSE,"DHT Holdings, Inc.",N
DHX,NYSE,"DHI Group, Inc. Common Stock",N
DHY,NYSE American,Credit Suisse High Yield Credit Fund Common Stock,N
DHY.R,NYSE American,"Credit Suisse High Yield Credit Fund Rights (expiring May 14, 2026) Rights",N
DIA,NYSE Arca,State Street SPDR Dow Jones Industrial Average ETF Trust,Y
DIAL,NYSE Arca,Columbia Diversified Fixed Income Allocation ETF,Y
DIBS,NASDAQ,"1stdibs.com, Inc. - Common Stock",N
DIEM,NYSE Arca,Franklin Emerging Market Core Dividend Tilt Index ETF,Y
DIG,NYSE Arca,ProShares Ultra Energy,Y
DIM,NYSE Arca,WisdomTree International MidCap Dividend Fund,Y
DIME,NASDAQ,CoinShares Altcoins ETF,Y
DIN,NYSE,"Dine Brands Global, Inc. Common Stock",N
DINO,NYSE,HF Sinclair Corporation Common Stock,N
DIOD,NASDAQ,Diodes Incorporated - Common Stock,N
DIPS,NYSE Arca,YieldMax Short NVDA Option Income Strategy ETF,Y
DIS,NYSE,Walt Disney Company (The) Common Stock,N
DISO,NYSE Arca,YieldMax DIS Option Income Strategy ETF,Y
DIT,NYSE American,AMCON Distributing Company Common Stock,N
DIV,NYSE Arca,Global X Super Dividend ETF,Y
DIVD,NASDAQ,Altrius Global Dividend ETF,Y
DIVE,NYSE Arca,Dana Concentrated Dividend ETF,Y
DIVG,NYSE Arca,Invesco S&P 500 High Dividend Growers ETF,Y
DIVI,NYSE Arca,Franklin International Core Dividend Tilt Index ETF,Y
DIVL,NYSE Arca,Madison Dividend Value ETF,Y
DIVO,NYSE Arca,Amplify CWP Enhanced Dividend Income ETF,Y
DIVP,NYSE Arca,Cullen Enhanced Equity Income ETF,Y
DIVS,NYSE Arca,Guinness Atkinson Dividend Builder ETF,Y
DIVY,NYSE,Sound Equity Dividend Income ETF,Y
DIVZ,NYSE Arca,Polen Dividend Income ETF,Y
DJCO,NASDAQ,Daily Journal Corp. (S.C.) - Common Stock,N
DJD,NYSE Arca,Invesco Dow Jones Industrial Average Dividend ETF,Y
DJIA,NYSE Arca,Global X Dow 30 Covered Call ETF,Y
DJP,NYSE Arca,iPath Bloomberg Commodity Index Total Return ETN,N
DJT,NASDAQ,Trump Media & Technology Group Corp. - Common Stock,N
DJTWW,NASDAQ,Trump Media & Technology Group Corp. - Warrants,N
DK,NYSE,"Delek US Holdings, Inc. Common Stock",N
DKI,NASDAQ,DarkIris Inc. - Class A Ordinary Shares,N
DKL,NYSE,"Delek Logistics Partners, L.P. Common Units representing Limited Partner Interests",N
DKNG,NASDAQ,DraftKings Inc. - Class A Common Stock,N
DKNX,NASDAQ,Defiance Daily Target 2X Long DKNG ETF,Y
DKS,NYSE,Dick's Sporting Goods Inc Common Stock,N
DLB,NYSE,Dolby Laboratories Common Stock,N
DLHC,NASDAQ,DLH Holdings Corp. - Common Stock,N
DLLL,NASDAQ,GraniteShares 2x Long DELL Daily ETF,Y
DLN,NYSE Arca,WisdomTree U.S. LargeCap Dividend Fund,Y
DLNG,NYSE,Dynagas LNG Partners LP Common Units,N
DLNG$A,NYSE,Dynagas LNG Partners LP 9.00% Series A Cumulative Redeemable Preferred Units,N
DLO,NASDAQ,DLocal Limited - Class A Common Shares,N
DLPN,NASDAQ,"Dolphin Entertainment, Inc. - Common Stock",N
DLR,NYSE,"Digital Realty Trust, Inc. Common Stock",N
DLR$J,NYSE,"Digital Realty Trust, Inc. 5.250% Series J Cumulative Redeemable Preferred Stock",N
DLR$K,NYSE,"Digital Realty Trust, Inc. 5.850% Series K Cumulative Redeemable Preferred Stock, par value $0.01 per share",N
DLR$L,NYSE,"Digital Realty Trust, Inc. 5.200% Series L Cumulative Redeemable Preferred Stock",N
DLS,NYSE Arca,WisdomTree International SmallCap Fund,Y
DLTH,NASDAQ,Duluth Holdings Inc. - Class B Common Stock,N
DLTR,NASDAQ,"Dollar Tree, Inc. - Common Stock",N
DLUX,NYSE Arca,DoubleLine Ultrashort Income ETF,Y
DLX,NYSE,Deluxe Corporation Common Stock,N
DLXY,NASDAQ,Delixy Holdings Limited - Class A Ordinary Shares,N
DLY,NYSE,DoubleLine Yield Opportunities Fund Common Shares of Beneficial Interest,N
DMA,NYSE,Destra Multi-Alternative Fund Common Stock,N
DMAA,NASDAQ,Drugs Made In America Acquisition Corp. - Ordinary Shares,N
DMAAR,NASDAQ,Drugs Made In America Acquisition Corp. - Rights,N
DMAAU,NASDAQ,Drugs Made In America Acquisition Corp. - Units,N
DMAC,NASDAQ,DiaMedica Therapeutics Inc. - Common Stock,N
DMB,NYSE,"BNY Mellon Municipal Bond Infrastructure Fund, Inc. Common Stock",N
DMBS,NYSE Arca,DoubleLine Mortgage ETF,Y
DMII,NASDAQ,Drugs Made In America Acquisition II Corp. - Ordinary Shares,N
DMIIR,NASDAQ,Drugs Made In America Acquisition II Corp. - Right,N
DMIIU,NASDAQ,Drugs Made In America Acquisition II Corp. - Unit,N
DMLP,NASDAQ,"Dorchester Minerals, L.P. - Common Units Representing Limited Partnership Interests",N
DMO,NYSE,Western Asset Mortgage Opportunity Fund Inc. Common Stock,N
DMRA,NASDAQ,"Damora Therapeutics, Inc. - Common Stock",N
DMRC,NASDAQ,Digimarc Corporation - Common Stock,N
DMX,NYSE Arca,DoubleLine Multi-Sector Income ETF,Y
DMXF,NASDAQ,iShares ESG Advanced MSCI EAFE ETF,Y
DNA,NYSE,"Ginkgo Bioworks Holdings, Inc. Class A Common Stock",N
DNL,NYSE Arca,WisdomTree Global ex-U.S. Quality Growth Fund,Y
DNLI,NASDAQ,Denali Therapeutics Inc. - Common Stock,N
DNMX,NASDAQ,Dynamix Corporation III - Class A Ordinary Shares,N
DNMXU,NASDAQ,Dynamix Corporation III - Unit,N
DNMXW,NASDAQ,Dynamix Corporation III - Warrants,N
DNN,NYSE American,Denison Mines Corp Ordinary Shares (Canada),N
DNNG,NASDAQ,Leverage Shares 2x Long DNN Daily ETF,Y
DNOW,NYSE,DNOW Inc. Common Stock,N
DNP,NYSE,"DNP Select Income Fund, Inc. Common Stock",N
DNTH,NASDAQ,"Dianthus Therapeutics, Inc. - Common Stock",N
DNUT,NASDAQ,"Krispy Kreme, Inc. - Common Stock",N
DOC,NYSE,"Healthpeak Properties, Inc. Common Stock",N
DOCN,NYSE,"DigitalOcean Holdings, Inc. Common Stock",N
DOCS,NYSE,"Doximity, Inc. Class A Common Stock",N
DOCU,NASDAQ,"DocuSign, Inc. - Common Stock",N
DOG,NYSE Arca,ProShares Short Dow30,Y
DOGZ,NASDAQ,Dogness (International) Corporation - Class A Common Stock,N
DOL,NYSE Arca,WisdomTree True Developed International Fund,Y
DOLE,NYSE,Dole plc Ordinary Shares,N
DOMH,NASDAQ,Dominari Holdings Inc. - Common Stock,N
DOMO,NASDAQ,"Domo, Inc. - Class B Common Stock",N
DON,NYSE Arca,WisdomTree U.S. MidCap Dividend Fund,Y
DOO,NASDAQ,BRP Inc. - Common Subordinate Voting Shares,N
DORM,NASDAQ,"Dorman Products, Inc. - Common Stock",N
DOUG,NYSE,Douglas Elliman Inc. Common Stock,N
DOV,NYSE,Dover Corporation Common Stock,N
DOW,NYSE,Dow Inc. Common Stock,N
DOX,NASDAQ,Amdocs Limited - Ordinary Shares,N
DOYU,NASDAQ,DouYu International Holdings Limited - American Depositary Shares,N
DPG,NYSE,Duff & Phelps Utility and Infrastructure Fund Inc.,N
DPRE,NYSE Arca,Virtus Duff & Phelps Real Estate Income ETF,Y
DPRO,NASDAQ,Draganfly Inc. - Common Shares,N
DPST,NYSE Arca,Direxion Daily Regional Banks Bull 3X ETF,Y
DPZ,NASDAQ,Domino's Pizza Inc - Common Stock,N
DQ,NYSE,"DAQO New Energy Corp. American Depositary Shares, each representing five ordinary shares",N
DRAI,NYSE Arca,Draco Evolution AI ETF,Y
DRAY,NYSE Arca,YieldMax DKNG Option Income Strategy ETF,Y
DRCT,NASDAQ,"Direct Digital Holdings, Inc. - Class A Common Stock",N
DRD,NYSE,DRDGOLD Limited American Depositary Shares,N
DRDB,NASDAQ,Roman DBDR Acquisition Corp. II - Ordinary shares,N
DRDBU,NASDAQ,Roman DBDR Acquisition Corp. II - Unit,N
DRDBW,NASDAQ,Roman DBDR Acquisition Corp. II - Warrants,N
DRES,NYSE Arca,GMO Domestic Resilience ETF,Y
DRH,NASDAQ,Diamondrock Hospitality Company - Common Stock,N
DRI,NYSE,"Darden Restaurants, Inc. Common Stock",N
DRIO,NASDAQ,DarioHealth Corp. - Common Stock,N
DRIP,NYSE Arca,Direxion Daily S&P Oil & Gas Exp. & Prod. Bear 2X ETF,Y
DRIV,NASDAQ,Global X Autonomous & Electric Vehicles ETF,Y
DRKY,NYSE Arca,VistaShares Target 15 DRUKMacro Distribution ETF,Y
DRLL,NYSE,Strive U.S. Energy ETF,Y
DRMA,NASDAQ,"Dermata Therapeutics, Inc. - Common Stock",N
DRMAW,NASDAQ,"Dermata Therapeutics, Inc. - Warrant",N
DRN,NYSE Arca,Direxion Daily Real Estate Bull 3X ETF,Y
DRNZ,NASDAQ,REX Drone ETF,Y
DRS,NASDAQ,"Leonardo DRS, Inc. - Common Stock",N
DRTS,NASDAQ,Alpha Tau Medical Ltd. - Ordinary Shares,N
DRTSW,NASDAQ,Alpha Tau Medical Ltd. - Warrant,N
DRUG,NASDAQ,Bright Minds Biosciences Inc. - common stock,N
DRUP,NYSE Arca,GraniteShares Nasdaq Select Disruptors ETF,Y
DRV,NYSE Arca,Direxion Daily Real Estate Bear 3X ETF,Y
DRVN,NASDAQ,Driven Brands Holdings Inc. - Common Stock,N
DSAC,NASDAQ,Daedalus Special Acquisition Corp. - Class A Ordinary Shares,N
DSACU,NASDAQ,Daedalus Special Acquisition Corp. - Unit,N
DSACW,NASDAQ,Daedalus Special Acquisition Corp. - Warrant,N
DSCO,NYSE Arca,DoubleLine Securitized Credit ETF,Y
DSGN,NASDAQ,"Design Therapeutics, Inc. - Common Stock",N
DSGR,NASDAQ,"Distribution Solutions Group, Inc. - Common Stock",N
DSGX,NASDAQ,The Descartes Systems Group Inc. - Common Stock,N
DSI,NYSE Arca,iShares ESG MSCI KLD 400 ETF,Y
DSL,NYSE,DoubleLine Income Solutions Fund Common Shares of Beneficial Interests,N
DSM,NYSE,"BNY Mellon Strategic Municipal Bond Fund, Inc. Common Stock",N
DSMC,NYSE,Distillate Small/Mid Cash Flow ETF,Y
DSP,NASDAQ,Viant Technology Inc. - common stock,N
DSPY,NYSE Arca,Tema S&P 500 Historical Weight ETF Strategy,Y
DSS,NYSE American,"DSS, Inc. Common Stock",N
DSTL,NYSE Arca,Distillate U.S. Fundamental Stability & Value ETF,Y
DSTX,NYSE,Distillate International Fundamental Stability & Value ETF,Y
DSU,NYSE,"Blackrock Debt Strategies Fund, Inc. Common Stock",N
DSWL,NASDAQ,"Deswell Industries, Inc. - Common Shares",N
DSX,NYSE,Diana Shipping inc. common stock,N
DSX$B,NYSE,Diana Shipping Inc. Perpetual Preferred Shares Series B (Marshall Islands),N
DSX.W,NYSE,Diana Shipping inc. Warrants,N
DSY,NASDAQ,Big Tree Cloud Holdings Limited - Class A Ordinary Shares,N
DSYWW,NASDAQ,Big Tree Cloud Holdings Limited - Warrants,N
DT,NYSE,"Dynatrace, Inc. Common Stock",N
DTAN,NYSE Arca,Sparkline International Intangible Value ETF,Y
DTB,NYSE,DTE Energy Company 2020 Series G 4.375% Junior Subordinated Debentures due 2080,N
DTCR,NASDAQ,Global X Data Center & Digital Infrastructure ETF,Y
DTCX,NASDAQ,"Datacentrex, Inc. - Common Stock",N
DTD,NYSE Arca,WisdomTree U.S. Total Dividend Fund,Y
DTE,NYSE,DTE Energy Company Common Stock,N
DTEC,NYSE Arca,ALPS Disruptive Technologies ETF,Y
DTF,NYSE,DTF Tax-Free Income 2028 Term Fund Inc. Common Stock,N
DTG,NYSE,DTE Energy Company 2021 Series E 4.375% Junior Subordinated Debentures,N
DTH,NYSE Arca,WisdomTree International High Dividend Fund,Y
DTI,NASDAQ,Drilling Tools International Corporation  - Common Stock,N
DTIL,NASDAQ,"Precision BioSciences, Inc. - Common Stock",N
DTK,NYSE,DTE Energy Company 2025 Series H 6.25% Junior Subordinated Debentures due 2085,N
DTM,NYSE,"DT Midstream, Inc. Common Stock",N
DTRE,NYSE Arca,First Trust Alerian Disruptive Technology Real Estate ETF,Y
DTSQ,NASDAQ,DT Cloud Star Acquisition Corporation - Ordinary Shares,N
DTSQR,NASDAQ,DT Cloud Star Acquisition Corporation - Right,N
DTSQU,NASDAQ,DT Cloud Star Acquisition Corporation - Units,N
DTSS,NASDAQ,Datasea Intelligent Technology Ltd. - Class A Ordinary Shares,N
DTST,NASDAQ,Data Storage Corporation - Common Stock,N
DTSTW,NASDAQ,Data Storage Corporation - Warrant,N
DTW,NYSE,DTE Energy Company 2017 Series E 5.25% Junior Subordinated Debentures due 2077,N
DUG,NYSE Arca,ProShares UltraShort Energy,Y
DUHP,NYSE Arca,Dimensional US High Profitability ETF,Y
DUK,NYSE,Duke Energy Corporation (Holding Company) Common Stock,N
DUK$A,NYSE,"Duke Energy Corporation Depositary Shares, each representing a 1/1,000th interest in a share of 5.75% Series A Cumulative Redeemable Perpetual Preferred Stock",N
DUKB,NYSE,Duke Energy Corporation 5.625% Junior Subordinated Debentures due 2078,N
DUKH,NASDAQ,Ocean Park High Income ETF,Y
DUKQ,NYSE Arca,Ocean Park Domestic ETF,Y
DUKX,NASDAQ,Ocean Park International ETF,Y
DUKZ,NYSE Arca,Ocean Park Diversified Income ETF,Y
DULL,NYSE Arca,"MicroSectors Gold -3X Inverse Leveraged ETNs due January 29, 2043",Y
DUNK,NYSE Arca,Dana Unconstrained Equity ETF,Y
DUO,NASDAQ,Fangdd Network Group Ltd. - Class A Ordinary Shares,N
DUOG,NASDAQ,Leverage Shares 2X Long DUOL Daily ETF,Y
DUOL,NASDAQ,"Duolingo, Inc. - Class A Common Stock",N
DUOT,NASDAQ,"Duos Technologies Group, Inc. - Common Stock",N
DUSB,NYSE Arca,Dimensional Ultrashort Fixed Income ETF,Y
DUSL,NYSE Arca,Direxion Daily Industrials Bull 3X ETF,Y
DUST,NYSE Arca,Direxion Daily Gold Miners Index Bear 2X ETF,Y
DUTY,NYSE Arca,U.S. Defense ETF,Y
DV,NYSE,"DoubleVerify Holdings, Inc. Common Stock",N
DVA,NYSE,DaVita Inc. Common Stock,N
DVAL,NASDAQ,BrandywineGLOBAL-Dynamic US Large Cap Value ETF,Y
DVDN,NYSE Arca,Kingsbarn Dividend Opportunity ETF,Y
DVGR,NASDAQ,DAC 3D Dividend Growth ETF,Y
DVIN,NASDAQ,WEBs Industrials XLI Defined Volatility ETF,Y
DVLT,NASDAQ,Datavault AI Inc. - Common Stock,N
DVLU,NASDAQ,First Trust Dorsey Wright Momentum & Value ETF,Y
DVN,NYSE,Devon Energy Corporation Common Stock,N
DVND,NYSE Arca,Touchstone Dividend Select ETF,Y
DVOL,NASDAQ,First Trust Dorsey Wright Momentum & Low Volatility ETF,Y
DVQQ,NASDAQ,WEBs QQQ Defined Volatility ETF,Y
DVRE,NASDAQ,WEBs Real Estate XLRE Defined Volatility ETF,Y
DVSP,NASDAQ,WEBs SPY Defined Volatility ETF,Y
DVUT,NASDAQ,WEBs Utilities XLU Defined Volatility ETF,Y
DVXB,NASDAQ,WEBs Materials XLB Defined Volatility ETF,Y
DVXC,NASDAQ,WEBs Communication Services XLC Defined Volatility ETF,Y
DVXE,NASDAQ,WEBs Energy XLE Defined Volatility ETF,Y
DVXF,NASDAQ,WEBs Financial XLF Defined Volatility ETF,Y
DVXK,NASDAQ,WEBs Technology XLK Defined Volatility ETF,Y
DVXP,NASDAQ,WEBs Consumer Staples XLP Defined Volatility ETF,Y
DVXV,NASDAQ,WEBs Health Care XLV Defined Volatility ETF,Y
DVXY,NASDAQ,WEBs Consumer Discretionary XLY Defined Volatility ETF,Y
DVY,NASDAQ,iShares Select Dividend ETF,Y
DVYA,NYSE Arca,iShares Asia / Pacific Dividend 30 Index Fund Exchange Traded Fund,Y
DVYE,NYSE Arca,iShares Emerging Markets Dividend Index Fund Exchange Traded Fund,Y
DWAS,NASDAQ,Invesco Dorsey Wright SmallCap Momentum ETF,Y
DWAW,NASDAQ,AdvisorShares Dorsey Wright FSM All Cap World ETF,Y
DWM,NYSE Arca,WisdomTree International Equity Fund,Y
DWMF,NYSE Arca,WisdomTree International Multifactor Fund,Y
DWSH,NASDAQ,AdvisorShares Dorsey Wright Short ETF,Y
DWSN,NASDAQ,Dawson Geophysical Company - Common Stock,N
DWTX,NASDAQ,"Dogwood Therapeutics, Inc.  - Common Stock",N
DWUS,NASDAQ,AdvisorShares Dorsey Wright FSM US Core ETF,Y
DWX,NYSE Arca,State Street SPDR S&P International Dividend ETF,Y
DX,NYSE,"Dynex Capital, Inc. Common Stock",N
DX$C,NYSE,"Dynex Capital, Inc. 6.900% Series C Fixed-to-Floating Rate Cumulative Redeemable Preferred Stock",N
DXC,NYSE,DXC Technology Company Common Stock,N
DXCM,NASDAQ,"DexCom, Inc. - Common Stock",N
DXD,NYSE Arca,ProShares UltraShort Dow30,Y
DXF,NYSE American,"Eason Technology Limited American Depositary Shares (each representing sixty-thousand (60,000) Ordinary Shares)",N
DXIV,NYSE Arca,Dimensional International Vector Equity ETF,Y
DXJ,NYSE Arca,WisdomTree Japan Hedged Equity Fund,Y
DXLG,NASDAQ,"Destination XL Group, Inc. - Common Stock",N
DXPE,NASDAQ,"DXP Enterprises, Inc. - Common Stock",N
DXR,NASDAQ,Daxor Corporation - Closed End Fund,N
DXST,NASDAQ,Decent Holding Inc. - Class A Ordinary Shares,N
DXUV,NYSE Arca,Dimensional US Vector Equity ETF,Y
DXYZ,NYSE,Destiny Tech100 Inc. Common Stock,N
DY,NYSE,"Dycom Industries, Inc. Common Stock",N
DYAI,NASDAQ,"Dyadic International, Inc. - Common Stock",N
DYFI,NASDAQ,IDX Dynamic Fixed Income ETF,Y
DYLD,NYSE Arca,LeaderShares Dynamic Yield ETF,Y
DYLG,NYSE Arca,Global X Dow 30 Covered Call & Growth ETF,Y
DYN,NASDAQ,"Dyne Therapeutics, Inc. - Common Stock",N
DYNB,NASDAQ,Hartford Dynamic Bond ETF,Y
DYNC,NASDAQ,Dynamix Corporation - Class A Ordinary Share,N
DYNCU,NASDAQ,Dynamix Corporation - Unit,N
DYNCW,NASDAQ,Dynamix Corporation - Warrant,N
DYNF,NYSE Arca,iShares U.S. Equity Factor Rotation Active ETF,Y
DYOR,NASDAQ,Insight Digital Partners II - Class A Ordinary Shares,N
DYORU,NASDAQ,Insight Digital Partners II - Units,N
DYORW,NASDAQ,Insight Digital Partners II - Warrants,N
DYTA,NASDAQ,SGI Dynamic Tactical ETF,Y
DZZ,NYSE Arca,"DB Gold Double Short ETN due February 15, 2038",N
E,NYSE,ENI S.p.A. Common Stock,N
EA,NASDAQ,Electronic Arts Inc. - Common Stock,N
EAD,NYSE American,Allspring Income Opportunities Fund Common Shares,N
EAF,NYSE,GrafTech International Ltd. Common Stock,N
EAFG,NYSE Arca,Pacer Developed Markets Cash Cows Growth Leaders ETF,Y
EAGG,NYSE Arca,iShares ESG Aware U.S. Aggregate Bond ETF,Y
EAGL,NYSE Arca,Eagle Capital Select Equity ETF,Y
EAI,NYSE,"Entergy Arkansas, LLC First Mortgage Bonds, 4.875% Series Due September 1, 2066",N
EAPR,NYSE Arca,Innovator Emerging Markets Power Buffer ETF April,Y
EARN,NYSE,Ellington Credit Company Common Shares of Beneficial Interest,N
EART,NASDAQ,Global X Rare Earth & Critical Materials ETF,Y
EASG,NYSE Arca,Xtrackers MSCI EAFE Selection Equity ETF,Y
EASY,NASDAQ,Liberty One Defensive Dividend Growth ETF,Y
EAT,NYSE,"Brinker International, Inc. Common Stock",N
EBAY,NASDAQ,eBay Inc. - Common Stock,N
EBC,NASDAQ,"Eastern Bankshares, Inc. - Common Stock",N
EBF,NYSE,"Ennis, Inc. Common Stock",N
EBI,NASDAQ,Longview Advantage ETF,Y
EBIT,NYSE Arca,Harbor AlphaEdge Small Cap Earners ETF,Y
EBIZ,NASDAQ,Global X E-commerce ETF,Y
EBMT,NASDAQ,"Eagle Bancorp Montana, Inc. - Common Stock",N
EBND,NYSE Arca,State Street SPDR Bloomberg Emerging Markets Local Bond ETF,Y
EBON,NASDAQ,Ebang International Holdings Inc. - Class A Ordinary Shares,N
EBS,NYSE,Emergent BioSolutions Inc. Common Stock,N
EBUF,NYSE Arca,Innovator Emerging Markets 10 Buffer ETF - Quarterly,Y
EC,NYSE,Ecopetrol S.A. American Depositary Shares,N
ECAT,NYSE,BlackRock ESG Capital Allocation Term Trust Common Shares of Beneficial Interest,N
ECBK,NASDAQ,"ECB Bancorp, Inc. - Common Stock",N
ECC,NYSE,Eagle Point Credit Company Inc. Common Stock,N
ECC$D,NYSE,Eagle Point Credit Company Inc. 6.75% Series D Preferred Stock,N
ECCC,NYSE,Eagle Point Credit Company Inc. 6.50% Series C Term Preferred Stock due 2031,N
ECCU,NYSE,Eagle Point Credit Company Inc. 7.75% Notes due 2030,N
ECCV,NYSE,Eagle Point Credit Company Inc. 5.375% Notes due 2029,N
ECCW,NYSE,Eagle Point Credit Company Inc. 6.75% Notes due 2031,N
ECCX,NYSE,Eagle Point Credit Company Inc. 6.6875% Notes due 2028,N
ECF,NYSE American,Ellsworth Growth and Income Fund Ltd.,N
ECF$A,NYSE American,Ellsworth Growth and Income Fund Ltd. 5.25% Series A Cumulative Preferred Shares (Liquidation Preference $25.00 per share),N
ECG,NYSE,"Everus Construction Group, Inc. Common Stock",N
ECL,NYSE,Ecolab Inc. Common Stock,N
ECML,NYSE Arca,Euclidean Fundamental Value ETF,Y
ECNS,NYSE Arca,iShares MSCI China Small-Cap ETF,Y
ECO,NYSE,Okeanis Eco Tankers Corp. Common Stock,N
ECON,NYSE Arca,Columbia Research Enhanced Emerging Economies ETF,Y
ECOR,NASDAQ,"electroCore, Inc. - Common Stock",N
ECOW,NASDAQ,Pacer Emerging Markets Cash Cows 100 ETF,Y
ECPG,NASDAQ,Encore Capital Group Inc - Common Stock,N
ECVT,NYSE,Ecovyst Inc. Common Stock,N
ECX,NASDAQ,ECARX Holdings Inc. - Class A Ordinary shares,N
ECXWW,NASDAQ,ECARX Holdings Inc. - Warrants,N
ED,NYSE,"Consolidated Edison, Inc. Common Stock",N
EDAP,NASDAQ,"EDAP TMS S.A. - American Depositary Shares, each representing One Ordinary Share",N
EDBL,NASDAQ,Edible Garden AG Incorporated - Common Stock,N
EDBLW,NASDAQ,Edible Garden AG Incorporated - Warrant,N
EDC,NYSE Arca,Direxion Emerging Markets Bull 3X ETF,Y
EDD,NYSE,"Morgan Stanley Emerging Markets Domestic Debt Fund, Inc. Common Stock",N
EDF,NYSE,Virtus Stone Harbor Emerging Markets Income Fund Common Shares of Beneficial Interest,N
EDGF,NYSE Arca,3EDGE Dynamic Fixed Income ETF,Y
EDGH,NYSE Arca,3EDGE Dynamic Hard Assets ETF,Y
EDGI,NYSE Arca,3EDGE Dynamic International Equity ETF,Y
EDGQ,NYSE Arca,Global X Nasdaq-100 Income Edge ETF,Y
EDGU,NYSE Arca,3EDGE Dynamic US Equity ETF,Y
EDGX,NYSE Arca,Global X U.S. 500 Income Edge ETF,Y
EDHL,NASDAQ,Everbright Digital Holding Limited - Ordinary Shares,N
EDIT,NASDAQ,"Editas Medicine, Inc. - Common Stock",N
EDIV,NYSE Arca,State Street SPDR S&P Emerging Markets Dividend ETF,Y
EDN,NYSE,Empresa Distribuidora Y Comercializadora Norte S.A. (Edenor) American Depositary Shares,N
EDOG,NYSE Arca,ALPS Emerging Sector Dividend Dogs ETF,Y
EDOW,NYSE Arca,First Trust Dow 30 Equal Weight ETF,Y
EDRY,NASDAQ,EuroDry Ltd. - Common Shares,N
EDSA,NASDAQ,"Edesa Biotech, Inc. - Common Shares",N
